1-199 equipable items, 200- potions, 300- scrolls, 400-books, 500- artifacts, 600 quest items 700- message scrolls ;;;;;;;;;;;;;;;;
476;item209;Power Cure;5000;Book;Misc;S77;1;3;15;Learning Book;78;0;0;0;0;A spell book.  (To learn this spell, pick the book up and right-click over a character's portrait in the inventory screen.  Your character must know the Body magic skill to learn this spell.)
477;item207;Light Bolt;1000;Book;Misc;S78;1;3;3;Learning Book;78;0;0;0;0;A spell book.  (To learn this spell, pick the book up and right-click over a character's portrait in the inventory screen.  Your character must know the Light magic skill to learn this spell.)
478;item207;Destroy Undead;1500;Book;Misc;S79;1;3;3;Learning Book;78;0;0;0;0;A spell book.  (To learn this spell, pick the book up and right-click over a character's portrait in the inventory screen.  Your character must know the Light magic skill to learn this spell.)
479;item207;Dispel Magic;2000;Book;Misc;S80;1;3;3;Learning Book;78;0;0;0;0;A spell book.  (To learn this spell, pick the book up and right-click over a character's portrait in the inventory screen.  Your character must know the Light magic skill to learn this spell.)
480;item207;Paralyze;2500;Book;Misc;S81;1;3;3;Learning Book;78;0;0;0;0;A spell book.  (To learn this spell, pick the book up and right-click over a character's portrait in the inventory screen.  Your character must know the Light magic skill to learn this spell.)
481;item208;Summon Wisp;3000;Book;Misc;S82;1;3;8;Learning Book;78;0;0;0;0;A spell book.  (To learn this spell, pick the book up and right-click over a character's portrait in the inventory screen.  Your character must know the Light magic skill to learn this spell.)
482;item208;Day of the Gods;3500;Book;Misc;S83;1;3;8;Learning Book;78;0;0;0;0;A spell book.  (To learn this spell, pick the book up and right-click over a character's portrait in the inventory screen.  Your character must know the Light magic skill to learn this spell.)
483;item208;Prismatic Light;4000;Book;Misc;S84;1;3;8;Learning Book;78;0;0;0;0;A spell book.  (To learn this spell, pick the book up and right-click over a character's portrait in the inventory screen.  Your character must know the Light magic skill to learn this spell.)
484;item210;Day of Protection;5000;Book;Misc;S85;1;3;14;Learning Book;78;0;0;0;0;A spell book.  (To learn this spell, pick the book up and right-click over a character's portrait in the inventory screen.  Your character must know the Light magic skill to learn this spell.)
485;item210;Hour of Power;6000;Book;Misc;S86;1;3;14;Learning Book;78;0;0;0;0;A spell book.  (To learn this spell, pick the book up and right-click over a character's portrait in the inventory screen.  Your character must know the Light magic skill to learn this spell.)
486;item210;Sunray;7500;Book;Misc;S87;1;3;14;Learning Book;78;0;0;0;0;A spell book.  (To learn this spell, pick the book up and right-click over a character's portrait in the inventory screen.  Your character must know the Light magic skill to learn this spell.)
487;item209;Divine Intervention;10000;Book;Misc;S88;1;3;19;Learning Book;78;0;0;0;0;A spell book.  (To learn this spell, pick the book up and right-click over a character's portrait in the inventory screen.  Your character must know the Light magic skill to learn this spell.)
488;item207;Reanimate;1000;Book;Misc;S89;1;3;3;Learning Book;78;0;0;0;0;A spell book.  (To learn this spell, pick the book up and right-click over a character's portrait in the inventory screen.  Your character must know the Dark magic skill to learn this spell.)
489;item207;Toxic Cloud;1500;Book;Misc;S90;1;3;3;Learning Book;78;0;0;0;0;A spell book.  (To learn this spell, pick the book up and right-click over a character's portrait in the inventory screen.  Your character must know the Dark magic skill to learn this spell.)
490;item207;Vampiric Weapon;2000;Book;Misc;S91;1;3;3;Learning Book;78;0;0;0;0;A spell book.  (To learn this spell, pick the book up and right-click over a character's portrait in the inventory screen.  Your character must know the Dark magic skill to learn this spell.)
491;item207;Shrinking Ray;2500;Book;Misc;S92;1;3;3;Learning Book;78;0;0;0;0;A spell book.  (To learn this spell, pick the book up and right-click over a character's portrait in the inventory screen.  Your character must know the Dark magic skill to learn this spell.)
492;item208;Shrapmetal;3000;Book;Misc;S93;1;3;8;Learning Book;78;0;0;0;0;A spell book.  (To learn this spell, pick the book up and right-click over a character's portrait in the inventory screen.  Your character must know the Dark magic skill to learn this spell.)
493;item208;Control Undead;3500;Book;Misc;S94;1;3;8;Learning Book;78;0;0;0;0;A spell book.  (To learn this spell, pick the book up and right-click over a character's portrait in the inventory screen.  Your character must know the Dark magic skill to learn this spell.)
494;item208;Pain Reflection;4000;Book;Misc;S95;1;3;8;Learning Book;78;0;0;0;0;A spell book.  (To learn this spell, pick the book up and right-click over a character's portrait in the inventory screen.  Your character must know the Dark magic skill to learn this spell.)
495;item210;Dark Grasp;5000;Book;Misc;S96;1;3;14;Learning Book;78;0;0;0;0;A spell book.  (To learn this spell, pick the book up and right-click over a character's portrait in the inventory screen.  Your character must know the Dark magic skill to learn this spell.)
496;item210;Dragon Breath;6000;Book;Misc;S97;1;3;14;Learning Book;78;0;0;0;0;A spell book.  (To learn this spell, pick the book up and right-click over a character's portrait in the inventory screen.  Your character must know the Dark magic skill to learn this spell.)
497;item210;Armageddon;7500;Book;Misc;S98;1;3;14;Learning Book;78;0;0;0;0;A spell book.  (To learn this spell, pick the book up and right-click over a character's portrait in the inventory screen.  Your character must know the Dark magic skill to learn this spell.)
498;item209;Souldrinker;10000;Book;Misc;S99;1;3;19;Learning Book;78;0;0;0;0;A spell book.  (To learn this spell, pick the book up and right-click over a character's portrait in the inventory screen.  Your character must know the Dark magic skill to learn this spell.)
499;null;book 499;0;0;0;0;0;0;0;0;1;0;0;0;0;book 499
500;item235;Elsenrail;20000;Weapon;Sword;3d3;14;Artifact;20;Longsword;1;0;0;29;159;(Accuracy +40, 10-20 points of Light damage) The Forge of Chaos was destroyed in the making of the Swords of Balance. Legend says the Blade of Light, Elsenrail, and the Blade of Dark, Glomenthal, will play major roles in the last act of the universe.
501;item296;Glomenthal;20000;Weapon;Sword;3d3;14;Artifact;20;Longsword;1;0;0;29;159;(Might +40, 10-20 points of Dark damage) The Forge of Chaos was destroyed in the making of the Swords of Balance. Legend says the Blade of Light, Elsenrail, and the Blade of Dark, Glomenthal, will play major roles in the last act of the universe.
502;item236;Terminus;15000;Weapon;Sword;3d4;14;Artifact;20;Broadsword;3;0;0;22;141;(Armsmaster skill +7, Air Resistance +30) As a child, before he carved his barbarian kingdom in Vori, Lars Eilief found this sword deep in an ice cave. When he died, it was set adrift with him on his funeral barge. How it ended up in Jadame is a mystery.
503;item237;Judicious Measure;20000;Weapon;Sword;2d4;13;Artifact;20;Cutlass;4;0;0;33;136;(Endurance +40, Luck +40, Ogre Slaying) Before there was a Regnan Empire, the ancestors of the Trolls of Ironsand lived on Regna Island. With this blade and a horde of sea raiders, Hareck I ousted the Trolls and formed his pirate nation.
504;item240;Elderaxe;20000;Weapon;Axe;4d2;12;Artifact;20;Axe;7;0;0;43;129;(Might +20, Swift, 6-12 points of Cold damage, Minotaur) When the Dark Dwarves carved the first Minotaur labyrinth into the heart of Mt. Ashenbane they forged this axe for Xaxius, the first herdmaster.
505;item241;Volcano;15000;Weapon2;Axe;3d7;15;Artifact;20;Two-Handed Axe;8;0;0;43;157;"(10-20 points of Fire damage, Fire Resistance +40) The mad artificer, Cornelius of Blackshire, built this axe for the purpose of clearing the trees around his country estate. ""A single blow will both fell a tree and render it into firewood!"" he was heard to exclaim. That he was soon found slain and the axe gone missing is proof that someone saw a better use for the tool."
506;item045;Wyrm Spitter;20000;Weapon1or2;Spear;1d9;14;Artifact;20;Spear;9;0;0;17;141;(Endurance +20, Dragon Slaying, Swift) Arguably the best dragon hunter of all times, Sir Ryan Smedly carried this mighty spear with him on all his expeditions, claiming that with it in hand, he could best any dragon in single combat. This proved true, but nevertheless he was slain by no less than a dozen dragons who ambushed him at Shadowmarsh Pass.
507;item243;Guardian;15000;Weapon1or2;Spear;3d6;15;Artifact;20;Halberd;10;0;0;48;160;(+10 to all attributes, 10-20 points of Body damage) The great Vampire, Korbu was known to use living men to guard his crypt during daylight hours. Compelled by a spell of enslavement, these sorry souls would walk their rounds carrying these mighty halberds. When Korbu mysteriously vanished, and the slave spell failed, a few of these weapons appeared in the larger world.
508;item239;Foulfang;20000;Weapon;Dagger;2d3;10;Artifact;20;Long Dagger;6;0;0;20;94;(Vampiric, 10 points of Poison damage, Vampire) At the conclusion of the Vampires' War of the Chalice, Korbu exacted horrific retribution on his defeated enemy, Calden Fain. It is better for the world that knowledge of the necromantic arts which rendered Fain--body and soul--into this living blade, is lost.
509;item249;Scepter of Kings;20000;Weapon;Mace;2d4;14;Artifact;20;Mace;14;0;0;20;95;"(Personality + 40, Regenerate Hit Points) Uri Hossana, King of the Western Elves, also called ""The Drunken King,"" was deposed the day he carelessly misplaced his scepter of office while on a hunting trip. This proved to be the last blunder of an incapable ruler. His advisors relieved him of his crown and left him to fend for himself in the Howling Marsh. He was never seen again."
510;item247;Breaker;20000;Weapon;Mace;3d3;12;Artifact;20;Club;16;0;0;36;187;(Might +20, Endurance +20, 10-20 points of Body damage) Trollish folklore is full of the fables of Sevenstrong Burlfist who with Biter, his faithful wolf companion, and his mighty club, Breaker, endlessly quested for the Silver Rose. Fables? One must wonder, if Breaker exists, then why not too, the Silver Rose?
511;item250;Staff of the Swamp;20000;Weapon2;Staff;3d4;10;Artifact;20;Staff;17;0;0;31;113;"(of Shielding; Immune to disease, paralysis, and poison) Nemerit, an otherwise unremarkable witch of the last era, was renown for her staff artificing skill. She created a staff for every conceivable use. It is said she carried this staff on reagent collecting trips into the swamplands."
512;item245;Longseeker;20000;Missile;Bow;5d2;10;Artifact;20;Bow;12;0;0;26;101;(Accuracy +50, Swift, Bow skill +4) Legends tell of many great archer heroes, but none greater than Brennan Morland of whom it was said once pierced a gold sovereign at 300 paces in an archery tournament. Now, holding his bow you must wonder if the legend owes more to the bow than the man.
513;item251;Serendine's Preservation;20000;Armor;Leather;4;30;Artifact;20;Leather Armor;20;0;0;0;0;(Regenerates Spell Points, Endurance +30) A mage known as much for frailty of body as for magical prowess, Serendine of Freehaven built this armor to make the most of his strengths and the least of his weaknesses.
514;item252;Glomenmail;20000;Armor;Chain;8;40;Artifact;20;Chainmail;21;0;0;0;0;(+10 to all statistics, +10 to all resistances, Dark Elf) Dark and Light Elven dealings have been peaceable, if uneasy, for centuries. Before that there was nothing but war. Few suits of this Dark Elven war armor have survived the ravages of time. Those that have are understandably, coveted.
515;item253;Supreme Plate;20000;Armor;Plate;20;50;Artifact;20;Plate Armor;22;0;0;0;0;(Swift, +15 Speed, +15 Accuracy, Knight) Each grandmaster of the Blackshire Armorers' Guild creates a masterpiece suit of plate as proof of his right to hold his station. It is not unusual for a guild member to spend ten to twenty years in the creation of one of these suits.
516;item254;Eclipse;0;Shield;Shield;6;15;Artifact;20;Large Shield;23;0;0;38;73;Quest Item: (of Spirit, of Body, of Mind, Cleric) When the First Temple of the Sun was burned in the War of Dove and Crow fought between the Sun and Moon temples, the holy altar was melted. The altar's metal was later collected and incorporated into this shield carried by Sun Priest Derico during his final deciding campaign of the war.
517;item261;Fleetfingers;20000;Gauntlets;Misc;3;0;Artifact;20;Gauntlets;30;0;0;0;0;(+8 to Disarm Trap, Bow, and Armsmaster skills) That she would actually have a name for her gloves, is evidence of the flamboyant, if deserved, conceit of Darcie Darby--most widely known for her theft of the bejeweled Rod of Right, part of the royal regalia of Enroth.
518;item262;Herald's Boots;20000;Boots;Misc;2;8;Artifact;20;Boots;31;0;0;0;0;(Speed + 30, Swift, Immunity to Sleep) When Jerico Ironfist secured the throne in the First War of Enrothian Succession, he sent forth heralds to spread the news. They were given pairs of these boots so the news would be spread quickly and thus soonest end widespread civil unrest.
519;item140;Ring of Planes;20000;Ring;Misc;0;0;Artifact;20;Ring;32;0;0;0;0;(+40 to Fire, Earth, Water and Air resistances) When the cartographer Alvia Morrania went to chart the terrain of the elemental planes she went well prepared. This ring of general protection was among the many special items commissioned by the Enrothian courts in support of her expedition.
520;item256;Drogg's Helm;20000;Helm;Misc;2;10;Artifact;20;Helm;25;0;0;0;0;(Personality +15, Intellect +15, Regenerates Hit Points) In the history of the barbarian tribes of Vori, it is rare to find a long reigning chieftain. Rarer still is one who held his position through magic rather than might. Drogg was such--a warrior mage who survived many years of rival challenges. It is said that he wore his helmet, even in sleep. Now that you possess it, you understand why.
521;item258;Crown of Final Dominion;20000;Helm;Misc;0;0;Artifact;30;Crown;27;0;0;0;0;(Intellect +50, of Dark Magic, Lich) So named by its creator and only sovereign wearer, Mederon, the first and last Lich Emperor of Nighon. The everlasting dynasty he hoped to found lasted barely a dozen years. Mederon escaped the fate of his kingdom. It is said he still lives as a madman and searches the world for his lost crown.
522;item260;Archangel Wings;20000;Cloak;Misc;1;9;Artifact;20;Cloak;29;0;0;0;0;(Feather Falling, Intellect + 30, All magic resistances + 10) When Angels fall from grace, they lose their wings. Since this is an event of extreme infrequency, angel wings are a very rare commodity. Archangel wings are almost never seen. When used as a material, they imbue the resulting item with fantastic powers.
523;item234;Snake;30000;Weapon;Sword;3d4;12;Relic;30;Longsword;1;0;0;23;169;(Slows target, Water Resistance -50, Personality -15) The pommel of this sword is gruesomely butted by a shrunken medusa's head. Though greatly diminished, the medusa's power flows along Snake's blade and into its targets--a good design, but poorly implemented, for some of the negative energies flow into the sword's wielder as well.
524;item004;Havoc;30000;Weapon;Sword;3d3;15;Relic;30;Longsword;1;0;0;15;136;(Speed +70, Accuracy +70, Armor Class -20) Havoc's enchantment makes it able to readily defeat any target's defenses. Unfortunately, its aggressive spirit makes it indifferent to parrying movements.
525;item010;Finality;30000;Weapon2;Sword;4d5;15;Relic;30;Two-Handed Sword;2;0;0;17;161;(10-20 points of Fire damage, Slow, Speed -20) When the arch assassin, Demetri Razen was finally brought to justice, it was found that his skin was granted unusual hardness by a permanent enchantment. Normal blades would not cut him, so Finality was forged to deliver the death blow sentenced by the Enrothian courts. 
526;item248;Hell's Cleaver;30000;Weapon;Axe;4d2;12;Relic;30;Axe;7;0;0;24;124;"(Might + 70, Accuracy +70, Personality -50, Intellect -50) So called because of its power to demonize its wielder, nevertheless, there are many who would willingly pay the price for the power offered by ""Hell's Cleaver."""
527;item242;Spiritslayer;30000;Weapon1or2;Spear;1d9;13;Relic;30;Spear;9;0;0;17;124;(Vampiric, Might +50, Luck -40) Many under the rule of Luthiner the Severe saw the existence of his spear Spiritslayer as proof of the existence of evil. The injuries caused by the spear go beyond the physical as Spiritslayer takes a strike as an opportunity to drink its target's very essence.
528;item244;Trident of Rulership;30000;Weapon1or2;Spear;2d6;13;Relic;30;Spear;9;0;0;20;133;(Water Breathing, +70 Water Resistance, -70 Fire Resistance) The Trident of Rulership was never meant to be on dry land, yet when the once mighty, ocean to ocean, Triton empire collapsed, many of its greatest artifacts including those of its royal treasure were looted and made their way to the surface.
529;item238;Blade of Mercy;30000;Weapon;Dagger;2d2;15;Relic;30;Dagger;5;0;0;17;84;(Might +40, 4-10 points Electrical damage, Accuracy -40, Necromancer) Though generally considered unfashionable among current necromantic customs, live sacrifice was once widely practiced. To reduce the cruelty inflicted on his victims, the Necromancer Ferredine the Merciful created a blade capable of bringing about a quicker and less suffered end.
530;item083;Staff of Elements;30000;Weapon2;Staff;2d4;4;Relic;30;Staff;17;0;0;34;108;(of Air Magic, of Fire Magic, of Water Magic, of Earth Magic, -40 Armor Class) By imposing upon its wielder a deepened state of concentration, the Staff of Elements increases his or her affinity with elemental magic to a profound degree. Of course, it is not always a good thing to have one's attention taken away from one's immediate concerns.
531;item059;Tournament Bow;30000;Missile;Bow;5d2;10;Relic;30;Bow;12;0;0;19;87;(Accuracy +100, Bow skill + 5, Armor Class -20) This bow was built to the specifications of the great Elven tournament archer, Terin Tourfeather. More concerned with fancy shooting than with the realities of the battlefield, the bow's detrimental effects were of no concern to Tourfeather--more workaday wielders should pay more heed.
532;item246;Lightning Crossbow;30000;Missile;Bow;4d2;12;Relic;30;Crossbow;13;0;0;36;87;(Swift, Accuracy -50, Dark Elf) An ingenious combination of the mechanical and magical went into the creation of this self-cocking crossbow which launches its quarrels with incredible force. That the same launching force causes it to kick like a mule means only the most skilled can use it to any good effect.
533;item251;Last Stage Cuirass;30000;Armor;Leather;4;15;Relic;30;Leather Armor;20;0;0;0;0;(Personality +80, Intellect +70, -30 Mind and Spirit resistances) The final stage of degeneration from their human form leaves a Lich completely soulless and thus immune to certain magics. Such liches often curse their personal items with vulnerabilities to these magics to dissuade others from using them.
534;item255;Herondale's Lost Shield;30000;Shield;Shield;4;10;Relic;30;Small Shield;24;0;0;61;52;"(Immune to Fear, Stone, Paralysis, and Sleep; Personality -15, Luck -15) The great knight Gerrald Herondale abandoned this shield after it took the brunt of a dark and deadly curse. Though it still retained its great powers, the shield was also weighed down with malevolent energies."
535;item141;Ring of Fusion;30000;Ring;Misc;0;0;Relic;30;Ring;32;0;0;0;0;(of Water, Alchemy skill + 5, Intellect +40, Endurance -20) A lost relic of the Freehaven Alchemists' Guild, until its disappearance, this ring was the signet of the guildmaster. It was meant to be worn only during the mixing of the most powerful potions for it drew much energy from the user.
536;item115;Lucky Hat;30000;Helm;Misc;0;0;Relic;30;Hat;26;0;0;0;0;(Luck + 90, Personality -50) The only reason someone would wear this hat is for the luck it conveys. It is the farthest thing from flattering!
537;item121;Berserker Belt;30000;Belt;Misc;0;0;Relic;30;Belt;28;0;0;0;0;"(Might +100, Immune to Fear, Accuracy -30, Armor Class -15) An experiment of the Blackshire Artificers' Guild, this belt was designed to turn its wearer into the perfect warrior--mighty and fearless. No more were made when in field tests it became apparent that ""foolhardy"" and ""careless"" were not virtues of the perfect warrior."
538;item068;Mace of the Sun;12000;Weapon;Mace;3d4;7;Special;0;Mace;14;Elemental Slaying;0;33;124;Though at first it appears to be the same type of mace carried by Sun Temple clerics everywhere, this item seems to thrum with conflicting energies.
539;item045;Ebonest;0;Weapon1or2;Spear;2d9;13;Special;0;Spear;9;Dragon Slaying;0;17;139;Quest Item: Charles Quixote's personal spear of Dragon slaying, Ebonest is a fine weapon indeed. When used against a Dragon, it seems to aim unerringly for the chinks between its target's tough scales.
540;item010;Sword of Whistlebone;0;Weapon2;Sword;4d5;12;Special;0;Two-Handed Sword;2;Dragon Slaying;0;17;159;Quest Item: That the Whistlebones would settle upon such a fierce weapon for their heirloom speaks much of their commitment to the family business of Dragon hunting.
541;item040;Axe of Balthazar;0;Weapon2;Axe;3d7;15;Special;0;Two-Handed Axe;8;of Ice;0;41;110;"Quest Item: No Minotaur kings wear a crown. Instead as their badge of office they carry great axes of the finest workmanship. This axe was lost when Balthazar was betrayed by the Vori Frost Giants. That it is strongly enchanted is clear; when used in battle its blows deliver both normal damage and impart a numbing bite of freezing cold."
542;item060;Noblebone Bow;15000;Missile;Bow;5d4;12;Special;30;Bow;12;of Carnage;0;30;100;"Bows of Kreegan bone are highly sought after; the material is strong and takes enchantments easily. The most sought after bone comes from Kreegans of the devil race's former ruling class."
543;null;artifact 543;0;0;0;0;0;0;0;0;1;0;0;0;0;artifact 543
544;null;artifact 544;0;0;0;0;0;0;0;0;1;0;0;0;0;artifact 544
545;null;artifact 545;0;0;0;0;0;0;0;0;1;0;0;0;0;artifact 545
546;null;artifact 546;0;0;0;0;0;0;0;0;1;0;0;0;0;artifact 546
547;null;artifact 547;0;0;0;0;0;0;0;0;1;0;0;0;0;artifact 547
548;null;artifact 548;0;0;0;0;0;0;0;0;1;0;0;0;0;artifact 548
549;null;artifact 549;0;0;0;0;0;0;0;0;1;0;0;0;0;artifact 549
550;null;artifact 550;0;0;0;0;0;0;0;0;1;0;0;0;0;artifact 550
551;null;artifact 551;0;0;0;0;0;0;0;0;1;0;0;0;0;artifact 551
552;null;artifact 552;0;0;0;0;0;0;0;0;1;0;0;0;0;artifact 552
553;null;artifact 553;0;0;0;0;0;0;0;0;1;0;0;0;0;artifact 553
554;null;artifact 554;0;0;0;0;0;0;0;0;1;0;0;0;0;artifact 554
555;null;artifact 555;0;0;0;0;0;0;0;0;1;0;0;0;0;artifact 555
556;null;artifact 556;0;0;0;0;0;0;0;0;1;0;0;0;0;artifact 556
557;null;artifact 557;0;0;0;0;0;0;0;0;1;0;0;0;0;artifact 557
558;null;artifact 558;0;0;0;0;0;0;0;0;1;0;0;0;0;artifact 558
559;null;artifact 559;0;0;0;0;0;0;0;0;1;0;0;0;0;artifact 559
560;null;artifact 560;0;0;0;0;0;0;0;0;1;0;0;0;0;artifact 560
561;null;artifact 561;0;0;0;0;0;0;0;0;1;0;0;0;0;artifact 561
562;null;artifact 562;0;0;0;0;0;0;0;0;1;0;0;0;0;artifact 562
563;null;artifact 563;0;0;0;0;0;0;0;0;1;0;0;0;0;artifact 563
564;null;artifact 564;0;0;0;0;0;0;0;0;1;0;0;0;0;artifact 564
565;null;artifact 565;0;0;0;0;0;0;0;0;1;0;0;0;0;artifact 565
566;null;artifact 566;0;0;0;0;0;0;0;0;1;0;0;0;0;artifact 566
567;null;artifact 567;0;0;0;0;0;0;0;0;1;0;0;0;0;artifact 567
568;null;artifact 568;0;0;0;0;0;0;0;0;1;0;0;0;0;artifact 568
569;null;artifact 569;0;0;0;0;0;0;0;0;1;0;0;0;0;artifact 569
570;null;artifact 570;0;0;0;0;0;0;0;0;1;0;0;0;0;artifact 570
571;null;artifact 571;0;0;0;0;0;0;0;0;1;0;0;0;0;artifact 571
572;null;artifact 572;0;0;0;0;0;0;0;0;1;0;0;0;0;artifact 572
573;null;artifact 573;0;0;0;0;0;0;0;0;1;0;0;0;0;artifact 573
574;null;artifact 574;0;0;0;0;0;0;0;0;1;0;0;0;0;artifact 574
575;null;artifact 575;0;0;0;0;0;0;0;0;1;0;0;0;0;artifact 575
576;null;artifact 576;0;0;0;0;0;0;0;0;1;0;0;0;0;artifact 576
577;null;artifact 577;0;0;0;0;0;0;0;0;1;0;0;0;0;artifact 577
578;null;artifact 578;0;0;0;0;0;0;0;0;1;0;0;0;0;artifact 578
579;null;artifact 579;0;0;0;0;0;0;0;0;1;0;0;0;0;artifact 579
580;null;artifact 580;0;0;0;0;0;0;0;0;1;0;0;0;0;artifact 580
581;null;artifact 581;0;0;0;0;0;0;0;0;1;0;0;0;0;artifact 581
582;null;artifact 582;0;0;0;0;0;0;0;0;1;0;0;0;0;artifact 582
583;null;artifact 583;0;0;0;0;0;0;0;0;1;0;0;0;0;artifact 583
584;null;artifact 584;0;0;0;0;0;0;0;0;1;0;0;0;0;artifact 584
585;null;artifact 585;0;0;0;0;0;0;0;0;1;0;0;0;0;artifact 585
586;null;artifact 586;0;0;0;0;0;0;0;0;1;0;0;0;0;artifact 586
587;null;artifact 587;0;0;0;0;0;0;0;0;1;0;0;0;0;artifact 587
588;null;artifact 588;0;0;0;0;0;0;0;0;1;0;0;0;0;artifact 588
589;null;artifact 589;0;0;0;0;0;0;0;0;1;0;0;0;0;artifact 589
590;null;artifact 590;0;0;0;0;0;0;0;0;1;0;0;0;0;artifact 590
591;null;artifact 591;0;0;0;0;0;0;0;0;1;0;0;0;0;artifact 591
592;null;artifact 592;0;0;0;0;0;0;0;0;1;0;0;0;0;artifact 592
593;null;artifact 593;0;0;0;0;0;0;0;0;1;0;0;0;0;artifact 593
594;null;artifact 594;0;0;0;0;0;0;0;0;1;0;0;0;0;artifact 594
595;null;artifact 595;0;0;0;0;0;0;0;0;1;0;0;0;0;artifact 595
596;null;artifact 596;0;0;0;0;0;0;0;0;1;0;0;0;0;artifact 596
597;null;artifact 597;0;0;0;0;0;0;0;0;1;0;0;0;0;artifact 597
598;null;artifact 598;0;0;0;0;0;0;0;0;1;0;0;0;0;artifact 598
599;null;artifact 599;0;0;0;0;0;0;0;0;1;0;0;0;0;artifact 599
600;null;quest item 600;0;N / A;Misc;0;0;0;0;0;1;0;0;0;0;quest item 600
601;null;quest item 601;0;N / A;Misc;0;0;0;0;0;1;0;0;0;0;quest item 601
