1-199 equipable items, 200- potions, 300- scrolls, 400-books, 500- artifacts, 600 quest items 700- message scrolls ;;;;;;;;;;;;;;;;
Item #;Pic File;Name;Value;Equip Stat;Skill Group;Mod1;Mod2;material;ID/Rep/St;Not identified name;Sprite Index;VarA;VarB;Equip X;Equip Y;Notes
0;;0;;;;;;0;0;;0;0;0;0;0;
1;item001;Longsword;50;Weapon;Sword;3d3;0;8;1;Longsword;1;0;0;14;131;Produced in great numbers, these slightly overbalanced swords are the arms of militiamen across the land.
2;item002;Trollish War Sword;200;Weapon;Sword;3d3;3;8;3;Longsword;1;0;0;16;132;Though of primitive craftsmanship, the great weight of this weapon's blade gives it excellent striking power.
3;item003;Dark Elven Longsword;350;Weapon;Sword;3d3;6;8;6;Longsword;1;0;0;14;136;The weapon of a merchantman from the Dark Elven city of Alvar. It's wavy edged blade holds a good edge.
4;item004;Templar's Sword;500;Weapon;Sword;3d3;9;8;9;Longsword;1;0;0;14;136;A sword for a true swordsman. Its lack of ornamentation bespeaks of the singular purpose of its design.
5;item005;Champion's Sword;650;Weapon;Sword;3d3;12;8;12;Longsword;1;0;0;18;138;These are made exclusively for members of the Erathian Order of the Blade. Since by tradition they are buried with their fallen wielders on hallowed and guarded grounds, they are rare articles indeed.
6;item006;Two-Handed Sword;400;Weapon2;Sword;4d5;0;8;1;Two-Handed Sword;2;0;0;16;162;This blade's great weight and length give its blows greater reach and damage. Otherwise, it is unexceptional in quality.
7;item007;Dark Elven Bastard Sword;500;Weapon2;Sword;4d5;2;8;4;Two-Handed Sword;2;0;0;18;155;Often carried by Elven caravan guards, these slightly under-proportioned blades are nearly, but not quite, light enough to brandish single-handedly.
8;item008;Minotaur Battlesword;800;Weapon2;Sword;4d5;6;8;7;Two-Handed Sword;2;0;0;20;169;Only those possessed of great strength and balance can gracefully swing these mighty blades let alone control them in the heat of combat.
9;item009;Dragonning Blade;1250;Weapon2;Sword;4d5;9;8;9;Two-Handed Sword;2;0;0;21;171;A deep biting, perfectly balanced weapon designed for one purpose - the slaying of dragons.
10;item010;Headsman's Reaver;2000;Weapon2;Sword;4d5;12;8;13;Two-Handed Sword;2;0;0;17;171;Crafted from purified erudine alloy and then tempered in a pool of roiling lava, this sword's practically undullable and perfectly balanced blade backs up its intimidating appearance.
11;item011;Iron Broadsword;100;Weapon;Sword;3d4;0;8;1;Broadsword;3;0;0;21;132;Some swordsmen swear that the soft metal of an iron sword gives them certain combat advantages. Those swordsmen never seem to be very old.
12;item012;Trollish Claymore;300;Weapon;Sword;3d4;2;8;4;Broadsword;3;0;0;19;138;Though of primitive design and craftsmanship, these Troll forged weapons are effective in strong hands.
13;item013;Lizardman Broadsword;600;Weapon;Sword;3d4;6;8;7;Broadsword;3;0;0;14;129;The Lizardmen produce a weapon capable of giving sturdy service.
14;item014;Knightly Broadsword;800;Weapon;Sword;3d4;9;8;9;Broadsword;3;0;0;12;131;The weight of this sword's untapered blade would make it unwieldy if not for its exacting counterbalance.
15;item015;Archangel Broadsword;1100;Weapon;Sword;3d4;12;8;13;Broadsword;3;0;0;20;145;This blade of pure erudine steel can cut armor like butter and gleams with a starlight glow. There are finer swords available, but their numbers can be counted on a single hand.
16;item016;Rusty Cutlass;40;Weapon;Sword;2d4;0;7;1;Cutlass;4;0;0;19;133;This weapon may once have been of some quality, though it would be hard to tell through the apparent years of corrosion.
17;item017;Goblin Scimitar;290;Weapon;Sword;2d4;2;7;3;Cutlass;4;0;0;20;134;After the Gowdar Deep Goblins were wiped off the face of Jadame in the Goblin-Ogre Wars, thousands of these weapons appeared on the common market.
18;item018;Regnan Cutlass;590;Weapon;Sword;2d4;6;7;5;Cutlass;4;0;0;19;140;Issued to Regnan seamen as a basic side arm, these blades have gained a sturdy reputation.
19;item019;Regnan Falchion;750;Weapon;Sword;2d4;8;7;9;Cutlass;4;0;0;18;143;The extremely forward balance of this weapon's blade gives it extra striking power, but requires great strength and skill from its wielder.
20;item020;Captain's Cutlass;1100;Weapon;Sword;2d4;11;7;12;Cutlass;4;0;0;25;136;Given to Regnan captains upon gaining their first command, these superior weapons help them to dominate their foes and subordinate.
21;item021;Crude Dagger;8;Weapon;Dagger;2d2;0;6;1;Dagger;5;0;0;16;77;As much a cutting tool and eating implement as a weapon, this dagger of soft steel will take an edge, but will lose it through very little use.
22;item022;Crystal Dagger;100;Weapon;Dagger;2d2;2;6;2;Dagger;5;0;0;12;75;These daggers are often carried by members of the Necromancers' Guild. The crystals used for the blades are found in the Shadowspire mountains. They are incredibly sharp, but have a tendency to shatter.
23;item023;Merchantman's Dagger;150;Weapon;Dagger;2d2;3;6;4;Dagger;5;0;0;14;80;This dagger is a typical example of those produced by the weaponsmiths of Alvar. It is made of hardened steel and has excellent balance.
24;item024;Master's Dagger;250;Weapon;Dagger;2d2;5;6;6;Dagger;5;0;0;19;80;Daggers of this quality are rare indeed. Made of erudine and rare woods, finished in gold, and set with a sizable ruby, this would be a rich man's extravagance if it were not also so effective a weapon.
25;item025;Fanged Blade;300;Weapon;Dagger;2d2;6;6;9;Dagger;5;0;0;20;45;The grip on this blade has clearly been rewrapped many times. It is said that such blades were used by the first Vampires who appeared millennia before the Silence. Could this possibly be one of those ancient weapons?
26;item026;Long Dagger;15;Weapon;Dagger;2d3;0;7;1;Long Dagger;6;0;0;15;102;With a blade in length between sword and dagger, these weapons are meant for the knife fighter who desires a bit of extra reach. This particular weapon is of mediocre workmanship in soft steel.
27;item027;Alvarian Poignard;200;Weapon;Dagger;2d3;2;7;4;Long Dagger;6;0;0;14;105;At many social functions in Alvar, it is deemed inappropriate to carry a sword. It is common for Elven warriors to carry a smaller blade in case things become uncivil.
28;item028;Regnan Fighting Knife;350;Weapon;Dagger;2d3;4;7;7;Long Dagger;6;0;0;13;103;Not wishing to be encumbered by a shield, many Regnan pirate raiders fight with a cutlass in one hand and one of these shorter blades in the other.
29;item030;Twilight Kris;500;Weapon;Dagger;2d3;6;7;9;Long Dagger;6;0;0;20;106;This wavy bladed long dagger of the best quality steel is the product of the Twilight weaponsmiths. The bat wing guard set with a blood red ruby marks it as the weapon of a Vampire.
30;item029;Dueling Long Dagger;790;Weapon;Dagger;2d3;7;7;12;Long Dagger;6;0;0;19;103;While they present a united front to the rest of the world, there is much internal strife among the Vampires of Shadowspire. By custom, very serious differences are settled in battle using these deadly blades of exquisite craftwork.
31;item031;Stone Axe;30;Weapon;Axe;4d2;0;5;1;Axe;7;0;0;30;84;Not much more than fire-hardened sticks lashed to sharp stones, these crude implements make for poor tools and weapons.
32;item032;Battle Hatchet;100;Weapon;Axe;4d2;2;5;2;Axe;7;0;0;28;86;Often carried by mounted knights as a secondary arm, battle hatchets are preferred by some who carry them to the exclusion to any sword.
33;item033;Battleaxe;250;Weapon;Axe;4d2;5;5;4;Axe;7;0;0;27;96;These heavy axes are meant to be carried one-handed for use against both armored and unarmored foes.
34;item034;Dwarven Battleaxe;550;Weapon;Axe;4d2;8;5;6;Axe;7;0;0;37;110;While the blacksmiths of the Jadamean Dark Dwarves are not as skilled as their Erathian counterparts, they still produce a product superior to most of what is otherwise available.
35;item035;Minotaur Battleaxe;775;Weapon;Axe;4d2;11;5;9;Axe;7;0;0;41;110;Forged by the Minotaurs for their wars with the Ogres, these axes are forged of a secret alloy formula. Their edges are difficult to dull and even harder to sharpen.
36;item036;Two-Handed Axe;225;Weapon2;Axe;3d7;0;6;1;Two-Handed Axe;8;0;0;40;92;As much an implement for working wood as a weapon, this crude axe can still deliver a telling blow.
37;item038;Footman's Axe;450;Weapon2;Axe;3d7;2;6;4;Two-Handed Axe;8;0;0;42;106;Capable of splitting armor, these two-handed axes are a favorite among soldiers facing mounted knights.
38;item037;Minotaur War Axe;900;Weapon2;Axe;3d7;5;6;7;Two-Handed Axe;8;0;0;48;87;These two-handed axes are commonly used by Minotaurs who have the strength necessary to handle their great weight.
39;item039;Elite Minotaur Axe;1250;Weapon2;Axe;3d7;9;6;9;Two-Handed Axe;8;0;0;46;103;These axes of superior workmanship are issued only to members of The Blackened Horn, the elite warriors who guard Minotaur holy sites.
40;item040;Minotaur Herdsman Axe;1500;Weapon2;Axe;3d7;12;6;13;Two-Handed Axe;8;0;0;42;112;Minotaur herdsmen lead their troops into battle wielding these devastating war axes of superlative balance and workmanship.
41;item041;Ogre Fighting Stick;15;Weapon1or2;Spear;1d9;0;6;1;Spear;9;0;0;17;116;A fire-hardened and sharpened sapling studded with thorns, spears like these are used by Ogre troops for drill and basic combat training. 
42;item042;Steel Spear;50;Weapon1or2;Spear;1d9;2;6;3;Spear;9;0;0;20;116;Basic spears are found stockpiled in the armories of many races, and for good reason - they are effective and deadly weapons. This particular one is of Minotaur origin.
43;item043;Elven Long Spear;250;Weapon1or2;Spear;1d9;5;6;6;Spear;9;0;0;13;119;The fine craftsmanship and balance of this alloy steel headed spear mark it as the work of the weaponsmiths of Alvar.
44;item044;War Spear;450;Weapon1or2;Spear;1d9;9;6;9;Spear;9;0;0;25;124;This spear is built for battle. Far to heavy to be wielded by the part-time militiaman, it is built for the professional warrior who prefers the spear to other weapons.
45;item045;Dragon Harpoon;650;Weapon1or2;Spear;1d9;13;6;12;Spear;9;0;0;17;111;The back-barbed stalt steel head of this weapon is designed to deal grievous damage to even the most ancient of dragons. Naturally, it is the spearfighter's choice for dispatching all foes.
46;item046;Improvised Voulge;200;Weapon1or2;Spear;3d6;0;6;1;Halberd;10;0;0;34;93;This simple poleaxe appears to have been made by attaching the blade of a farm implement to a poorly crafted spear.
47;item048;Halberd;400;Weapon1or2;Spear;3d6;3;6;3;Halberd;10;0;0;30;111;A versatile weapon combining the qualities of an axe and a spear, the halberd is designed to perform in formation and individual close quarter fighting.
48;item047;Beaked Halberd;700;Weapon1or2;Spear;3d6;6;6;5;Halberd;10;0;0;38;107;This improved halberd has a spiked blade opposite its axe face to provide both balance and a means of penetrating plate armor.
49;item049;Minotaur Campaign Pole-axe;1300;Weapon1or2;Spear;3d6;10;6;8;Halberd;10;0;0;38;123;"When the Minotaurs went to war with the Frost Giants of faraway Vori, their king Balthazar commissioned this polearm to arm his troops. He reportedly said, ""Since they will be gone so long, arm them with something versatile."""
50;item050;Labyrinth Grapple;1600;Weapon1or2;Spear;3d6;13;6;11;Halberd;10;0;0;24;135;Minotaurs have very little tolerance for intruders in their hallowed mazes. This fact is well evidenced in the attention paid to weapons constructed for the labyrinth guards.
51;item051;Hayfork;100;Weapon1or2;Spear;2d6;0;6;1;Trident;11;0;0;25;113;Though a common farming implement, this hayfork is of sturdy construction and could be an excellent, if improvised, weapon.
52;item052;Infantry Fork;400;Weapon1or2;Spear;2d6;2;6;3;Trident;11;0;0;27;137;A highly specialized piece of equipment intended to equalize contests between foot soldiers and mounted, armored opponents, these modified spears are effective if slightly clumsy weapons.
53;item053;Lizardman Trident;650;Weapon1or2;Spear;2d6;6;6;6;Trident;11;0;0;22;141;The blacksmiths on the Dagger Wound Islands craft a wide variety of spearheads. This trident is one of their most unusual designs. The barbed tines cause extra damage during straight thrusting attacks.
54;item054;Regnan Trident;900;Weapon1or2;Spear;2d6;9;6;9;Trident;11;0;0;23;130;No Regnan ship leaves port without a cache of tridents. Boarding attacks against their galleys seldom succeed against massed walls of their erudine tines.
55;item055;Triton Trident;1250;Weapon1or2;Spear;2d6;13;6;12;Trident;11;0;0;26;125;The first thing one notices when first handling this trident is that it is unusually cool to the touch. The second is a sense that the dragon turtle bone tines seem to seek vulnerabilities in their targets' defenses as if guided by an unseen hand.
56;item056;Hunting Bow;200;Missile;Bow;5d2;0;6;1;Bow;12;0;0;23;96;These lightweight bows of simple construction are meant for bringing down small game animals - not for direct combat. 
57;item057;Recurve Bow;300;Missile;Bow;5d2;2;3;3;Bow;12;0;0;21;102;Recurved bowstaves allows an archer to pull a heavier bow than they might otherwise be able to. Greater pull weight means greater arrow speed for increase range and damage.
58;item058;Snakewood Bow;400;Missile;Bow;5d2;4;3;6;Bow;12;0;0;24;100;The human soldiers of Enroth carry bows made from the native snakewood tree. The strong, flexible wood makes a sturdy bow.
59;item059;Elven Warbow;500;Missile;Bow;5d2;6;3;9;Bow;12;0;0;23;102;By laminating together layers of wood, steel, and bone the bowsmiths of Alvar have created a bow of perfect balance, strength and accuracy. The process consumes a lot of time, craft and expensive materials which explains the steep price these bows command.
60;item060;Devilbone Bow;750;Missile;Bow;5d2;7;3;12;Bow;12;0;0;30;100;Dark Elven bowsmiths have discovered that unusual characteristics of the Kreegan spinal column make it the best material for heavy bowstaves. A clever arrangement of composite pulleys make it possible for those of less than superhuman strength to pull these mighty weapons.
61;item061;Light Crossbow;50;Missile;Bow;4d2;0;4;1;Crossbow;13;0;0;28;70;Because of their ease of use, crossbows like these are stockpiled in militia armories everywhere. Their low pull strength and mediocre workmanship however, make them only moderately effective.
62;item062;Blood Drop Crossbow;200;Missile;Bow;4d2;3;4;3;Crossbow;13;0;0;26;75;A light crossbow of good quality, these weapons feature a grooved table, basic sights and a smooth releasing nut.
63;item063;Hunting Crossbow;300;Missile;Bow;4d2;5;4;6;Crossbow;13;0;0;32;83;Built for use in the field, this medium crossbow is designed for hunting, but is equally effective as a battle weapon.
64;item064;Caravaner's Crossbow;400;Missile;Bow;4d2;7;4;9;Crossbow;13;0;0;38;85;The Merchants of Alvar like to see their caravan guards well armed. This well-crafted heavy crossbow has a cranked drawing mechanism.
65;item065;Regnan Crossbow;550;Missile;Bow;4d2;8;4;12;Crossbow;13;0;0;37;92;The pirates of Regna Island have spent centuries perfecting their crossbow design. The resulting weapon has a crystal lensed sight and bowstaves of pure stalt - which would make the bow impossible to cock if not for the crank draw of erudine alloy.
66;item066;Mace;50;Weapon;Mace;2d4;0;6;1;Mace;14;0;0;22;116;A slight improvement over the common club, maces are better balanced, more durable, and deliver greater damage.
67;item067;Flail;150;Weapon;Mace;2d4;2;6;3;Flail;14;0;0;58;113;Though evolved from the farm implement which shares its name, the flail's great reach and striking power make it a fearsome weapon.
68;item068;Temple Mace;300;Weapon;Mace;2d4;5;6;6;Mace;14;0;0;33;126;"The sunray corona circling the head of this well made mace serves as a devotional declaration for Temple of the Sun clerics; it also greatly increases the damage of its blows. "
69;item069;Reverend Sceptre;450;Weapon;Mace;2d4;7;6;9;Mace;14;0;0;12;159;As much a symbol of office as weapon, these finely crafted maces are carried by inner circle Sun Temple priests. Its highly decorated shaft belies the effectiveness of the gilded erudine-steel head.
70;item070;Trollish War Mace;600;Weapon;Mace;2d4;11;6;12;Mace;14;0;0;30;177;While most races have concentrated on developing bladed weapons, the Trolls have always been content to refine the simple bludgeon. This brutal weapon forged as a single piece of stalt alloy is the finest example of their craft.
71;item071;Sledgehammer;120;Weapon;Mace;2d5;0;6;1;Hammer;15;0;0;26;76;This hammer is more a construction tool than a weapon. Still, it could deliver a telling, if clumsy, blow.
72;item072;Field Hammer;300;Weapon;Mace;2d5;3;6;3;Hammer;15;0;0;21;107;This hammer was designed as secondary infantry arm designed to finish off armored opponents who have fallen to the ground.
73;item073;Warhammer;450;Weapon;Mace;2d5;6;6;5;Hammer;15;0;0;26;103;An improved version of the field hammer, this weapon is heavier, better balanced and more durable. While it requires strength to wield, it is a terrible sight to armored and unarmored foes alike.
74;item074;Sun Hammer;650;Weapon;Mace;2d5;9;6;8;Hammer;15;0;0;19;107;Clerics of the Sun are prohibited from using bladed weapons. That they carry such fine warhammers is the natural result of this restriction. As an added measure of devotion, a reverse image of their sun symbol is embossed on the striking face.
75;item075;Trollish Maul;890;Weapon;Mace;2d5;12;6;12;Hammer;15;0;0;31;107;It is necessary to handle this weapon to appreciate its perfect grip and balance. The hammer's head is carved from a single mineral crystal. Trollish weaponsmiths spend a lifetime mastering the shaping technique to produce a head that retains incredible hardness without being shatter prone.
76;item076;Club;1;Weapon;Club;1d3;0;3;0;Club;16;0;0;16;119;A wooden head and handle studded with short iron spikes, the simple club's best attribute is that it can be constructed from found materials.
77;item077;Thornbark Club;100;Weapon;Club;1d3;3;3;2;Club;16;0;0;31;148;The Trolls of the Ironsand Desert make these clubs by fire-hardening the fantastically tough root wood of the thornbark tree.
78;item078;Overlord's Club;350;Weapon;Mace;3d3;6;3;5;Club;16;0;0;26;161;Troll tribal chieftains must win their position through trial by combat. The winner keeps his club as a symbol of office. The losers' clubs often find their way into the weapon marketplace.
79;item079;Journey Staff;40;Weapon2;Staff;2d4;0;3;1;Staff;17;0;0;10;63;Many dangers face the Jadamean traveler. Even the least battle-minded carry some sort of weapon. These iron ended walking sticks are a common choice.
80;item080;Orb Staff;150;Weapon2;Staff;2d4;2;3;3;Staff;17;0;0;14;88;This staff is topped with a head of polished turquoise to give it greater striking force.
81;item081;Priestly Staff;250;Weapon2;Staff;2d4;4;3;5;Staff;17;0;0;14;95;This finely decorated staff is the product of Lizardman craft. Wrapped with exotic leathers, and ended with a bronze footcap and striker, these staves are carried by Lizardman priests as a symbol of station.
82;item082;Serpent Staff;400;Weapon2;Staff;2d4;6;3;8;Staff;17;0;0;18;100;These rare staffs may appear unwieldy, but they are the product of sorcery. In combat they flex with animal intelligence to work in blows through their targets' defenses.
83;item083;Bone Staff;600;Weapon2;Staff;2d4;8;3;12;Staff;17;0;0;35;118;Fashioned from the spinal bones of wyverns and crowned by a dragon's lower spikeplate, these staves are the product of necromantic weaponcraft. It is unusual to find one of these deadly weapons that is not also carrying a powerful enchantment.
84;item084;Leather Jerkin;150;Armor;Leather;4;0;3;1;Leather Armor;20;0;0;0;0;This armor of thick, supple leather studded with brass offers minimal protection against blows.
85;item085;Hardened Leather Vest;250;Armor;Leather;4;2;3;4;Leather Armor;20;0;0;0;0;This item of leather armor has been hardened to offer increased protection. It is comfortable and light though offers little coverage.
86;item086;Caravaner's Leather;450;Armor;Leather;4;6;3;8;Leather Armor;20;0;0;0;0;This is the type of armor worn most often by those guarding Alverian merchant caravans. A hardened and internally braced breastplate covers an undersuit of tough but supple hide, offering the wearer full body protection with a minimal hampering of movement.
87;item087;Regnan Leather;750;Armor;Leather;4;12;3;10;Leather Armor;20;0;0;0;0;Though seemingly too thin to offer solid protection, this armor of Regnan design holds a subtle enchantment which makes the leather nearly steel tough. Additionally, a secret process makes the suit resistant to salt water corrosion.
88;item088;Alvarian Leather;1150;Armor;Leather;4;20;3;12;Leather Armor;20;0;0;0;0;"Leather armor sets of this quality are of the finest produced by the Alvarian Armorers' Guild. The stalt-alloy edged panels are virtually inpenetrable; their clever interlockings give the wearer excellent freedom of movement."
89;item089;Rusty Mail Vest;400;Armor;Chain;8;0;6;1;Chainmail;21;0;0;0;0;This corroded ring mail vest has seen better days. It has been field repaired in many places and even has a large patch of thinner mail salvaged from a piece of chain cowl.
90;item090;Steel Chainmail;600;Armor;Chain;8;4;6;5;Chainmail;21;0;0;0;0;Constructed of strong steel this is the type of armor worn by the rank and file foot soldiers of many armies.
91;item091;Minotaur Chainmail;900;Armor;Chain;8;10;6;10;Chainmail;21;0;0;0;0;Of a design originally created by the Minotaurs for their Vori campaigns, this type of chainmail, with its good coverage and fine construction, has proven popular among other races. Now the armorsmiths of Bathazar Lair construct it in sizes for any with ready gold to spend.
92;item092;Siertal Chainmail;1300;Armor;Chain;8;18;6;15;Chainmail;21;0;0;0;0;The Alvarian Dark Elves guard their siertal-alloy formula carefully. Chainmail made from this metal is both light and capable of turning the hardest blades.
93;item093;Erudine Chainmail;1800;Armor;Chain;8;28;6;20;Chainmail;21;0;0;0;0;Another master product of the Alvarian Armorers' Guild, this hybrid suit of plate and mail is made of siertal-alloy finished erudine with an attention to craftsmanship worthy of the precious materials.
94;item094;Rusty Breastplate;1000;Armor;Plate;20;0;9;1;Plate Armor;22;0;0;0;0;This piece of plate armor salvaged from a larger suit is so corroded it is a question whether it is equipment for a warrior or junk for the scrap man.
95;item095;Banded Plate;1400;Armor;Plate;20;8;9;8;Plate Armor;22;0;0;0;0;Bands of steel cover the mid-torso of this chain and plate chest armor. While lighter and simpler to construct than continuously formed plate, this armor offers less protection than heavier plate.
96;item096;Minotaur Plate;2000;Armor;Plate;20;18;9;15;Plate Armor;22;0;0;0;0;An example of the work produced by the Minotaur armorers of Balthazar Lair, this plate armor provides excellent mid-section protection. The arms are left free in the Minotaur-style.
97;item097;Dark Knight Plate;2700;Armor;Plate;20;30;9;20;Plate Armor;22;0;0;0;0;Though lined with felt and red velvet, and decorated with enamel and gilding, this armor is no showpiece. The siertal-alloy plates are light, but tough enough that they must have been worked with tools with erudine working faces.
98;item098;Dragoning Plate;3500;Armor;Plate;20;38;9;25;Plate Armor;22;0;0;0;0;The technique for making plate armor of erudine sheets is not known on Jadame. In fact, it is only produced by the master armorer, Derrick Goreth of Erathia who spent a lifetime constructing his famed White Light Forgeworks.
99;item099;Trollish Shield;200;Shield;Shield;6;0;4;1;Large Shield;23;0;0;32;57;A simple wooden shield of Trollish make, the design is often copied by apprentice armorsmiths just learning their craft.
100;item100;Thornbark Shield;300;Shield;Shield;6;1;4;4;Large Shield;23;0;0;43;39;Made from thornbark tree heartwood and rimmed with iron, this shield is sturdy, if a bit heavy.
101;item101;Regnan Tournament Shield;400;Shield;Shield;6;3;4;8;Large Shield;23;0;0;50;78;Every ten moons, the Regnans hold a great festival which includes a tournament of arms. The noble class contestants spare no expense in the commissioning of shields that are light, but tough enough to shelter them from harm.
102;item102;Veteran Shield;500;Shield;Shield;6;6;4;12;Large Shield;23;0;0;32;74;In the Demon Wars of Erathia, the Humans found that only erudine armor was proof against the fiery attacks of their foes. Bit by bit, pieces of this armor - like this shield - have made their way to Jadame.
103;item103;Dragon Hunter's Shield;800;Shield;Shield;6;13;4;16;Large Shield;23;0;0;64;85;The town of Kriegspire in Enroth had a problem with Dragons. These shields were their answer. Magically bound layers of erudine, stalt-steel and hydra leather, make a nearly unbreakable material resistant to most Dragon breath weapons.
104;item104;Wooden Buckler;100;Shield;Shield;4;0;4;1;Small Shield;24;0;0;32;32;This small shield is gripped in the off-weapon hand. The wielder is much dependent on agility to make use of its scant defensive coverage.
105;item105;Caravaner's Small Shield;200;Shield;Shield;4;2;4;4;Small Shield;24;0;0;47;47;Caravan guards traveling Merchant of Alvar trade routes must often cover long distances on foot. This shield, like the rest of their equipment is well made and lightweight.
106;item106;Calvary Shield;300;Shield;Shield;4;4;4;8;Small Shield;24;0;0;50;50;A favorite among mounted knights, these steel shields are strong enough to turn aside the points of pikemen.
107;item107;Death Head Shield;450;Shield;Shield;4;8;4;12;Small Shield;24;0;0;43;43;The Necromancers' Guild likes to arm its undead armies well. Their elite infantry carry these erudine alloy shield of great strength.
