#;Text;Notes;Owner;;
388;Things are sometime hidden in the dungeons and castles of this land.   You may have missed something without even knowing it was there.  Perception increases your chance of finding these hidden things. Mastery of the Perception skill triples your chances.  For 2500 gold and an Expert skill level of 7 in Perception, I will teach you.;Master Perception (6);James;;
389;Things are sometime hidden in the dungeons and castles of this land.  You may have missed something without even knowing it was there.  Perception increases your chance of finding these hidden things. Grand Mastery of the Perception skill quintuples your chances. For 6000 gold and a Master skill level of 10 in Perception, I will teach you.;Grand Master Perception (7);James;;
390;An Expert level in the Regeneration skill doubles the number of hit points that you recover over time.  Expert teaching of this skill requires a normal skill level of 4 and a fee of 2000 gold.;Expert Regeneration;James;;
391;A Master skill level in the Regeneration skill triples the number of hit points that you recover over time.  Master teaching of this skill requires a Expert skill level of 7 and a fee of 5000 gold.;Master Regeneration;James;;
392;Grand Mastery of the Regeneration skill quadruples the number of hit points that you recover over time.  Grand Master teaching of this skill requires a Master skill level of 10 and a fee of 8000 gold.;Grand Master Regeneration;James;;
393;Tired of chests blowing up in your face?  Sick of poison gas clouds, fireballs, and lightning bolts sending party members to the Great Beyond?  Expert Disarm Trap doubles your chance of disarming these traps before they go off.  I will teach you Expert Disarm Trap if you have a skill level of 4 and can pay 500 gold.;Expert Disarm_Trap (1);James;;
394;Tired of chests blowing up in your face?  Sick of poison gas clouds, fireballs, and lightning bolts sending party members to the Great Beyond?  Master Disarm Trap triples your chance of disarming these traps before they go off.  I will teach you Master Disarm Trap if you have an Expert skill level of 7 and can pay 2500 gold.;Master Disarm_Trap (13);James;;
395;Tired of chests blowing up in your face?  Sick of poison gas clouds, fireballs, and lightning bolts sending party members to the Great Beyond?  Grand Master Disarm Trap eliminates these pesky traps entirely before they go off.  I will teach you Grand Master Disarm Trap if you have a Master skill level of 10 and can pay 6000 gold.;Grand Master Disarm_Trap (3);James;;
396;I wish I could. Unfortunately, we make holy war with the foul Necromancers' Guild. All of the Sun Temple's resources, including myself, are dedicated to that cause.;;Verish NPC 467;;
397;"Adventure with you? Yes I will. In fact, before he left, Charles Quixote suggested just that. ""Nelix,"" he said, ""if those alliance heroes come by, you ought to consider going with them."" Apparently, he thinks highly of you. Well, his recommendation is enough for me. Shall we go?";;Nelix Uriel NPC 468;;
398;Go with you? I think not. Why would I want to join up with a bunch of amateurs when I have all the action I can handle here? Don't make me laugh. What can you offer me that a life of Dragon hunting does not?;;Nelix Uriel NPC 468;;
399;Go with you? I like the idea, but I must stay here. I am one of the last veteran warriors left here. I must stay to protect the village.;;Sethrc Thistlebone NPC 469;;
400;Yes, that sounds good. Though the village could use me to protect it, I think the best I could do for it would be to go with you. My people will be destroyed if the cataclysm is not ended. If I can do something to stop it, I should.;;Sethrc Thistlebone NPC 469;;
401;Join your group? I would be glad to. Not only have you done a great service for my herd, it has become clear to me that your actions will decide our very survival.;;Rionel NPC 470;;
402;Knowing what you are up against in combat can mean the difference between life and death.  Being able to identify the monsters and opponents you are fighting can make this difference. I can teach you Expert Identify Monster if you already have a skill level of 4 and pay 500 gold.;Expert Identify_Monster;James;;
403;He who runs away today lives to run away another day.  This doesn't necessarily mean he is a coward, however.  He may just be very smart.  He may know how his opponent attacks and what spells he may use, if any.  I can teach you Master Identify Monster if you have achieved an Expert skill level of 7 and can pay 2500 gold.;Master Identify_Monster;James;;
404;If you can probe your enemies defenses and know his weaknesses, you will always prevail.  With Grand Mastery of Identify Monster, you will know how your enemies attack and what their defenses are.  This knowledge will allow you to attack their weakest points. I can raise you to Grand Master of this skill if you have a Master skill level of 10 and pay 6000 gold.;Grand Master Identify_Monster;James;;
405;Knowledge of a single weapon is great.  Having knowledge of all weapons is even better.  Expert Armsmaster skill increases you chance to hit with any melee weapon you can wield. I can make you an Expert Armsmaster if you have a skill level of 4 and pay 2000 gold.;Expert Armsmaster;James;;
406;Knowledge of a single melee weapon is great.  Having knowledge of all melee weapons is even better. Master Armsmaster increases the damage you do with any weapon you can wield. I can make you a Master Armsmaster if you have an Expert skill level of 7 and pay 5000 gold.;Master Armsmaster;James;;
407;Knowledge of a single melee weapon is great.  Having knowledge of all melee weapons is even better.  Armsmaster skill decreases the recovery time of any melee weapon you are already skilled with and gives the chance for greater inflicted damage.  Grand Master expertise doubles both your chance to hit and damage bonuses for the skill. I can make you a Grand Master Armsmaster if you have a Master skill level of 10 and pay 8000 gold.;Grand Master Armsmaster;James;;
408;Join you? I must decline the offer. Though you have done a great service for my herd, I am not yet sure of your leadership. I want to help fight the cataclysm, but I'm not sure your way is the right one.;;Rionel NPC 470;;
409;Don't think your exploits have gone unnoticed! Clearly you are adventurers of the highest caliber. I would consider joining your team…that is, if you will have me.;;Adric Stellare NPC 471;;
410;"I see you too are adventurers. But…well, can I be frank? Though I don't doubt your potential, clearly you are not the most experienced group I've seen. I'd be happy to join you if you were more…shall we say, ""seasoned?""";;Adric Stellare NPC 471;;
411;Tired of the simple potions mixtures?  Want to make something new and potent?  Want to create compound potions?  This knowledge of Expert Alchemy can be yours if you demonstrate a skill level of 4 and pay 500 gold.;Expert Alchemy;James;;
412;Want to know how to use potions and compound potions to make white potions?  I can raise you to Master knowledge of Alchemy if you have an Expert skill level of 7 and pay 2500 gold.;Master Alchemy;James;;
413;The black potion is the Alchemist's ultimate creation!  They can affect so many different things and are even wonderful to taste!  Grand Mastery of Alchemy can be yours if you have a Master skill level of 10 in Alchemy, possess one of each of the best reagents and pay 6000 gold.;Grand Master Alchemy;James;;
414;Learning allows you to gain more experience from your travels and encounters. Expert Learning doubles the bonus to gained experience, leading you down the path of greater wisdom.  I will instruct you in Expert Learning if your skill level is 4 and you pay me 2000 gold.;Expert Learning (7);James;;
415;Learning allows you to gain more experience from your travels and encounters. Master Learning triples the bonus to gained experience, leading you down the path of greater wisdom.  I will instruct you in Master Learning if you have an Expert skill level of 7, pay me 5000 gold and have and Intellect of 50.;Master Learning (6);James;;
416;Learning allows you to gain more experience from your travels and encounters. Grand Master Learning quintuples the bonus to gained experience, leading you down the path of greater wisdom.  I will instruct you in Grand Master Learning if you have a Master skill level of 10, pay me 8000 gold and have and Intellect of 50.;Grand Master Learning (5);James;;
417;Puddle Thain, is a most promising student.  If you seek Expert instruction in the uses of the Staff, you can find him in the city of Ravenshore.;Expert Staff hint;Expert Staff (2);James;Puddle Thain
418;Celia Stone, Master of the Staff, dwells in Troll village of Rust in the Ironsand Desert.  She can instruct you to Mastery of the Staff is that is what you desire.;Master Staff hint;Master Staff (4);James;Celia Stone
419;Grand Master Tristen Stillwater, instructs all students of the Staff.  Only he can help you in attaining Grand Mastery of this fine weapon.  Seek him out in the city of Twilight at the base of the Shadowspire.;Grandmaster Staff hint;Grand Master Staff (6);James;Tristen Stillwater
420;Aerie Luodrin currently dwells in Ravenshore.  She is a most dedicated student of the uses of the Sword and can instruct you to and Expert skill level with the weapon.;Expert Sword hint;Expert Sword (2);James;Aerie Luodrin
421;"Unfortunately Jaycin Cardron, Master of the Sword, felt that his skills would be more, shall we say, ""profitable taught"" to the Dragon Hunter's of Garrote Gorge.  If you seek Master skill level with the Sword, you will have to go to him at the Garrote Gorge Dragon Hunter Camp.";Master Sword hint;Master Sword (13);James;Jaycin Cardron
422;Miyon Dragontracker, Grand Master of the Sword, has joined the knight, Charles Quixote in his quest to exterminate the Dragons of Garrote Gorge.  You can find Miyon at the Dragon Hunter's Fort.;Grandmaster Sword hint;Grand Master Sword (5);James;Miyon Dragontracker
423;The Expert instructor of the Dagger, Lori Vespers, lives in the Dark Elf city of Alvar.  Seek her out there.;Expert Dagger hint;Expert Dagger (3);James;Lori Vespers
424;Master Jobber can instruct students of the Dagger to Mastery.  He lives in the city of Ravenshore.;Master Dagger hint;Master Dagger (2);James;Jobber
425;Karla Nirses, the Grand Master of the Dagger trains all Regnan Pirates in the uses of the Dagger.  She dwells with them on the Island of Regna as they pay her well.;Grandmaster Dagger hint;Grand Master Dagger (13);James;Karla Nirses
426;Herald Foestryke, one of Charles Quixote's finest knights, is the Expert teacher of the skills of the Axe.  He can be found at the Dragon Hunter's Camp in Garrote Gorge.;Expert Axe hint;Expert Axe (5);James;Herald Foestryke
427;Jasp Hunter is the Master instructor of the axe.  He can teach you the skills that will lead to Mastery of the axe.  His home is in the seaside city of Ravenshore.;Master Axe hint;Master Axe (2);James;Jasp Hunter 
428;Grand Master Garic Senjac, is the Grand Master teacher of the ways of the Axe.  His home is in Balthazar Lair in the Ravage Roaming region.;Grandmaster Axe hint;Grand Master Axe (7);James;Garic Senjac
429;Matric Townsaver defended the city of Ravenshore against many Regnan Pirate raids.  His skill and instruction of the uses of the spear allowed the townsfolk to push the Pirates back. He can instruct you to Expert skill level with the spear.;Expert Spear hint;Expert Spear (2);James;Matric Townsaver
430;Ashandra Withersmythe is the Master teacher of the Spear.  Her instruction of the ways of the Spear will lead you to Mastery of the weapon.  She lives in the merchant city of Alvar.;Master Spear hint;Master Spear (3);James;Ashandra Withersmythe
431;Yarrow is the Grand Master of the Spear.  Her keen eye and stalking ability have aided her in attaining this level of skill.  She uses the Spear to stalk the poisonous couatl of the jungles of the Dagger Wound Islands.;Grandmaster Spear hint;Grand Master Spear (1);James;Yarrow
432;Shivan Keeneye is an Expert shot with the Bow.  Her teachings can lead you to an Expert skill level with this ranged weapon.  She lives in the village of Blood Drop on the Dagger Wound Islands.;Expert Bow hint;Expert Bow (1);James;Shivan Keeneye
433;Master Oberic Nosewort teaches students of the bow in his home in Ravenshore.  If you seek Mastery of this weapon you must seek him out there.;Master Bow hint;Master Bow (2);James;Oberic Nosewort
434;Solis, Grand Master of the Bow, lives in the Dark Elf city of Alvar.  She can teach you Grand Mastery of the Bow.;Grandmaster Bow hint;Grand Master Bow (3);James;Solis
435;Lisha Sourbrow teaches Expert uses of the Mace from her home in Ravenshore.;Expert Mace hint;Expert Mace (2);James;Lisha Sourbrow
436;Robert Morningstar, teaches Mastery of the Mace to the knights in Garrote Gorge.;Master Mace hint;Master Mace (5);James;Robert Morningstar
437;Brother Hearthsworn, the Grand Master of the Mace, retired to the peace of the Ironsand Desert, seeking tranquility among the dunes of that region.  His home is in the village of Rust.;Grandmaster Mace hint;Grand Master Mace (4);James;Brother Hearthsworn
438;Qillain Moore used to serve the knight, Charles Quixote, but disagreed with his crusade to slay all the Dragons in the Garrote Gorge area. Moore still teaches Expert uses of the Shield from his home in the city of Alvar.;Expert Shield hint;Expert Shield (3);James;Qillain Moore
439;Sheldon Nightwood lives in the city of Twilight, beneath the Necromancers' Guild on the Shadowspire.  She can teach you Mastery of the Shield.;Master Shield hint;Master Shield (6);James;Sheldon Nightwood
440;The knight, Peryn Reaverston, holds the title of Grand Master of the Shield.  He is currently in service to Charles Quixote and teaches knights in the proper uses of the shield.  Search him out in the Dragon Hunter's Camp in Garrote Gorge.;Grandmaster shield hint;Grand Master Shield (5);James;Peryn Reaverston
441;The Lizardman Thadin is the Expert instructor of the use of Leather armor.  His instruction will give you an Expert skill level with this armor.  You can find him on the Island of Dagger Wound.;Expert Leather hint;Expert Leather (1);James;Thadin
442;Master Shamus Hollyfield dwells in the Minotaur city, Balthazar Lair, which is located in the Ravage Roaming region.  He can teach you Mastery of Leather armor.;Master Leather hint;Master Leather (7);James;Shamus Hollyfield
443;Medwari Elmsmire makes the finest Leather armor in the realm.  She also holds the title of Grand Master of Leather Armor and can instruct you at her home in the village of Rust in the Ironsand Desert.;Grandmaster Leather hint;Grand Master Leather (4);James;Medwari Elmsmire
444;Tobren Forgewright assisted the city of Ravenshore in the First Pirate War.  Her forge glowed for four weeks straight as she made chain armor for the defenders of Ravenshore.  She still teaches Expert use of the armor from her home in the seaside port of Ravenshore.;Expert Chain hint;Expert Chain (2);James;Tobren Forgewright 
445;Halian Eversmyle learned all the skills he could from the Grand Master of Chain armor and then fled to the city of Alvar where he teaches Mastery of this armor to the Merchants of Alvar.  He will instruct you to Mastery as well.;Master Chain hint;Master Chain (13);James;Halian Eversmyle
446;Grand Master Seline Burnkindle teaches ways of using chain armor to its greatest advantage.  She lives among the Pirates of Regna.;Grandmaster Chain hint;Grand Master Chain (3);James;Seline Burnkindle
447;Bone teaches the Expert skills of Plate armor from his hut on Dagger Wound Island.;Expert Plate hint;Expert Plate (1);James;Bone
448;Master Botham was one of the finest warriors in the First Pirate War.  Ravenshore owes him a debt of gratitude.  Botham and his fellow swordsman led the charge against the first wave of Regnans.  Their Plate armor deflected all but the most serious blows.  He still teaches Mastery of Plate armor from his home.;Master Plate hint;Master Plate (2);James;Botham
449;Seth Ironfist, Grand Master of Plate Armor, is the true force behind Charles Quixote's crusade against the Dragons of Garrote Gorge.  Without his instruction in the use of Plate armor, Quixote's knights would be mere fodder before the wrath Redreaver's Dragons.;Grandmaster Plate hint;Grand Master Plate (5);James;Seth Ironfist
450;Taren Temper, fled Erathia to make a new life for himself among those who know nothing of the Temper history.  He teaches Expert skills in Fire Magic from his home in Ravenshore.;Expert Fire Magic hint;Expert Fire_Magic (2);James;Taren Temper
451;Solomon Steele, Master of Fire, lives in the tranquil city of Alvar.  He can teach you Mastery of Fire Magic.;Master Fire Magic hint;Master Fire_Magic (7);James;Solomon Steele
452;Burn, Grand Master of Fire dwells in the oppressive heat of the Plane of Fire.  Perhaps the Gate of Fire that has appeared in the Ironsand Desert will lead you to him.  He can instruct you in Grand Mastery of Fire Magic.  ;Grandmaster Fire Magic hint;Grand Master Fire_Magic (11);James;Inferno
453;Reshie teaches the Expert skill of Air Magic from his home on the Dagger Wound Islands.;Expert Air Magic hint;Expert Air_Magic (1);James;Reshie
454;Hollis Stormeye, Master of Air, made her home in Balthazar Lair, home of the Minotaurs.  ;Master Air Magic hint;Master Air_Magic (7);James;Hollis Stormeye
455;Cloud Nedlon sought to make a deal with the Lords of Air.  He left to find a way into the Plane of Air, where he thought he would learn all that remained unclear to him about the ways of Air Magic.  You will have to travel to the Plane of Air to see if he was successful.;Grandmaster Air Magic hint;Grand Master Air_Magic (9);James;Cloud Nedlon
456;Ulbrecht Pederton single handedly stopped the Second Pirate War.  He charged down the beach to come to Ravenshore's defense as the pirates began to land.  He manipulated the sea itself and forced the Regnan fleet back into the ocean.  Unfortunately this effort cost him the ability to use magic altogether.  He still, however, teaches the knowledge of Expert Water Magic.  He lives in Ravenshore to this day.;Expert Water Magic hint;Expert Water_Magic (2);James;Ulbrecht Pederton
457;Gregory Mist, Master of Water, makes his home in the village of Rust in the Ironsand Desert.  He claims to have a plan to use his magic to change the hot desert into a verdant green plain.  If he has the time, he can teach you Mastery of Water Magic.;Master Water Magic hint;Master Water_Magic (4);James;Gregory Mist
458;Black Current was once a powerful mage in this region.  Her ambition for power outgrew her caution and she attempted to conquer the Plane of Water.  She summoned a gate to the plane and stepped through.  She was never heard from again.  She was the Grand Master of Water Magic.  If she still lives you may find her in the Plane of Water.;Grandmaster Water Magic hint;Grand Master Water_Magic (12);James;Black Current
459;Ostrin Grivic, Expert instructor of Earth Magic, lives in the village of Blood Drop on the Dagger Wound Islands.;Expert Earth Magic hint;Expert Earth_Magic (1);James;Ostrin Grivic
460;Earth Magic Master Dorothy Sablewood helped end the First Pirate War.  With the aid of an unknown Air Mage, she erected walls of clay to keep the Regnan Pirates from leaving their boats.  She now teaches her skills from her home in Alvar.;Master Earth Magic hint;Master Earth_Magic (2);James;Dorothy Sablewood
461;Grand Master Griven passed into the Plane of Earth after teaching his final lesson to Dorothy Sablewood.  Perhaps he lives there to this day.  Who knows what transpires in an elemental plane?;Grandmaster Earth Magic hint;Grand Master Earth_Magic (10);James;Griven
462;Straton Hawthorne can raise you to Expert level in the arts of Spirit Magic. He makes his home in the port city of Ravenshore.;Expert Spirit Magic hint;Expert Spirit_Magic (2);James;Straton Hawthorne
463;Master Bethold Kern, serves the knight Charles Quixote in his crusade against the Dragons of the Garrote Gorge region.  Search him out there at the Dragon Hunter's Camp.  If you are lucky, he will have time to instruct you in Mastery of Spirit Magic.;Master Spirit Magic hint;Master Spirit_Magic (5);James;Bethold Kern
464;Lasiter Ravensight, is the Grand Master of Spirit Magic.  He lives in the Murmurwoods close to the Temple of the Sun, where he continues his studies in to the essence of Spirit.  He can raise your skill in Spirit Magic to Grand Mastery.;Grandmaster Spirit Magic hint;Grand Master Spirit_Magic (8);James;Lasiter Ravensight
465;Shane Krewlen, student of Mind Magic, can instruct you in the Expert skills of this arcane magic.  Seek him out in the Dark Elf city of Alvar.;Expert Mind Magic hint;Expert Mind_Magic (3);James;Shane Krewlen 
466;Barthine Lotts, Master of Mind Magic, dwells in the Minotaur city of Balthazar Lair in the Ravage Roaming region.  Through her instruction can gain Mastery of Mind Magic.;Master Mind Magic hint;Master Mind_Magic (7);James;Barthine Lotts
467;Gilad Dreamwright, Grand Master of Mind Magic, has joined many other Grand Masters of Magic in the Murmurwoods region.  Here they work with the Temple of the Sun to further their combined skills and knowledge.  Gilad can instruct you to Grand Master skill level in Mind Magic.;Grandmaster Mind Magic hint;Grand Master Mind_Magic (8);James;Gilad Dreamwright
468;Zevah Poised, Expert instructor of the arcane skills of Body Magic, lives with his people on the Islands of Dagger Wound in the Ifarine Sea.;Expert Body Magic hint;Expert Body_Magic (1);James;Zevah Poised
469;Tugor Arin, Master of Body Magic, practices his healing skills in the service of the knight Charles Quixote in the Garrote Gorge region.  His skills in Body Magic are put to good use healing the unfortunate young knights who are wounded in the crusade against the Dragons of Garrote Gorge.;Master Body Magic hint;Master Body_Magic (5);James;Tugor Arin
470;Grand Master Critias Snowtree, dwells in the peace of the Murmurwoods forest away from the trials and troubles of the world.  Only he can instruct you in the ways of Body Magic and raise you to Grand Mastery of this arcane skill.;Grandmaster Body Magic hint;Grand Master Body_Magic (8);James;Critias Snowtree
471;Archibald Dawnsglow, Expert instructor of Light Magic, practices his arts in the city of Ravenshore on the Ifarine Sea.  His parents gave his name not knowing that it was the same name as the leader of the Erathian Necromancers' Guild.  Archibald desires to have his own name made in the Light, not in the darkness of his namesake.;Expert Light Magic hint;Expert Light_Magic (2);James;Archibald Dawnsglow
472;Master Lunius Dawnbringer, dwells among the the Clerics of Murmurwoods.He can promote you to Master of Light Magic, if you can survive the dangers of the forest.;Master Light Magic hint;Master Light_Magic (13);James;Lunius Dawnbringer
473;Aldrin Cleareye, Grand Master of the Light, makes his home on the island of Regna.  He hopes to bring an end to the Pirates evil ways.  He can instruct you to Grand Masterey, if you survive the Pirates.;Grandmaster Light Magic hint;Grand Master Light_Magic (8);James;Aldrin Cleareye
474;Patwin Darkenmore, Expert teacher of the ways of Dark Magic, lives among the Dark Elves of Alvar.  ;Expert Dark Magic hint;Expert Dark_Magic (3);James;Patwin Darkenmore
475;Dark Magic Master Carla Umberpool followed the travels of Sithicus Shadowrunner, Grand Master of the Dark, and makes her home with the Necromancers of Shadowspire.;Master Dark Magic hint;Master Dark_Magic (13);James;Carla Umberpool
476;Sithicus Shadowrunner, Grand Master of the art of Dark Magic, and has established a home on the Island of Regna.  Here the pirate captains get her blessing on the ships before a raid.  She can instruct you in Grand Mastery of Dark Magic.;Grandmaster Dark Magic hint;Grand Master Dark_Magic (6);James;Sithicus Shadowrunner
477;Kyra Sparkmen, Expert teacher of the Identify Item skill, lives in the city of Alvar.  ;Expert Identify Item hint;Expert Identify_Item (1);James;Kyra Sparkmen
478;Eithian, Master instructor of the Identify Item skill, serves the Merchants of Alvar, and currently lives on the Dagger Wound Islands. Many travelers bring their prizes to Eithian for identification.  He may have to time to instruct you to Mastery of this skill if you travel to him.;Master Identify Item hint;Master Identify_Item (3);James;Eithian
479;Elzbet Roggen, Grand Master of the Identify Item skill, lives in the Shadowspire city of Twilight.  She can teach you what is needed to achieve Grand Mastery.;Grandmaster Identify Item hint;Grand Master Identify_Item (6);James;Elzbet Roggen
480;Fishner Thomb, retired from service with the Merchants of Alvar and returned to his home Island of Dagger Wound in the Ifarine Sea.  Seek him out there for his teachings in the Expert way of being a Merchant.;Expert Merchant hint;Expert Merchant (1);James;Fishner Thomb
481;Fenton Iverson, Master Merchant of Alvar, tests all who wish to advanced with the skills of a Merchant.  You will find Fenton in the merchant city of Alvar, where he can instruct you to Mastery of the Merchant skill.;Master Merchant;Master Merchant (3);James;Fenton Iverson
482;Raven Quicktoungue, Grand Master Merchant of Alvar, dwells in the city of Ravenshore.  There, Raven can watch the interaction of numerous races as the trade with each other.  Only he can raise your knowledge to Grand Mastery of the merchant skill.;Grandmaster Merchant hint;Grand Master Merchant (2);James;Raven Quicktoungue
483;Evandar Lotts teaches the Expert skills of Repairing Items.  He dwells in the seaside city of Ravenshore.;Expert Repair Item hint;Expert Repair_Item (3);James;Evandar Lotts 
