#;Text;Notes;Owner;;
1;My fellow Journeyman, we face grave times.  Hopefully our Master will find a way for us to leave this troubled region and return safely to Alvar.  I would not wish to end my life here, even though it is the place of my birth.;;S'ton;;
2;Dadeross led us here to trade with the Lizardman Clan of Onefang for their tobersk fruit.  He has gone to talk with Brekish Onefang, the village leader.  Perhaps you should look for him?;;S'ton;;
3;The Regnan Pirates are a threat to the economy and free travel in Jadame.  Very few boats ply the sea, for fear of being sunk…or worse!  When in Ravenshore, I did hear rumors of a small band of smugglers who have been working beneath the notice of the pirates.  I wonder how they do that!;;S'ton;;
4;"It is as I have read in the prophecy of the Unmaking! ""...and a Mountain of Fire shall rise from the sea, like a wound drawn by the quick stroke of a dagger…"".";;;;
;;;;;
"You must find a way off of these islands, if not for the caravan, at least for yourself!  Someone must take news of what has happened here to the Merchant Council in Alvar!  They must know of the cataclysm and of the Regnan raid!""";;Dadeross;;;
5;The pirates from the dread Island of Regna are using the cataclysm and the confusion created by it to aid them in overrunning the islands.  If they conquer Dagger Wound, they can use it as an outpost for direct raids on Ravenshore!  The Merchant Council in Alvar must be notified!  You must find a way to the boats and tell them!;;Dadeross;;
6;It will take several boats to ferry the entire caravan back to Ravenshore, or many trips by one boat.  This cannot be done until the waters around the Dagger Wound Islands are free from Regnan Pirates.  It is best that you return to Alvar and tell the Council of the Regnan attack.  They will send help to rescue us!;;Dadeross;;
7;In the middle of the night the ground shook!  Flaming rocks dropped from the sky!  Many of my people were hurt or killed!  Great damage was done to the village.  The bridges that allowed travel between the smaller islands and the main island were destroyed.  We found ourselves stuck on the main island, unable to reach those on the smaller islands who may be injured.  Many family members and friends are missing.  We cannot reach the islands with the boat docks, and thus we are unable to send to Ravenshore for help. I do not even know if any boats survived!;;Brekish Onefang;;
8;In time long past, my people used the Portals of Stone to travel quickly from island to island, but we have lost the knowledge of their operation. Only the pair connecting the village to the southwestern fields still functions. Now that the bridges are gone, we're trapped on the island!;;Brekish Onefang;;
9;A Cleric, by the name of Fredrick Talimere, has been living with us for the last few years.  He has been studying the Portals of Stone and the outer ruins of the Abandoned Temple.  Maybe he has the knowledge to get the Portals working again!  Find him and see if he will help!;;Brekish Onefang;;
10;"Ah yes…""the portals."" I have been studying them and the lost culture that built them for years.";;;;
;;;;;
"They were built by the civilization that had its day long before the Lizardmen came to inhabit these islands. They were a means of instantaneous travel between the islands. Sadly, the power stones needed to operate them are in short supply.""";;Fredrick Talimere;;;
11;The first night of the mountain of fire, I went to the beach to see if I could see anything of its eruption.  I cannot be certain, but as the volcano continued to erupt, I thought I saw Earth Elementals roaming the lava encrusted base of the mountain.;;Fredrick Talimere;;
12;So Clanleader Onefang gave you that power stone he was holding onto! It will power the portal on the southwestern tip of the island. To use it, hold an image of the stone in your mind as you step onto the portal.;;Fredrick Talimere;;
13;The ruins of a temple built by the lost civilization lies on the island just northwest of the main island. I have not explored it however, for dangerous reptiles have made it their lair. I do suspect that the temple leads to an underwater tunnel which surfaces near the boat docks on the northwest island.;;;;
;;;;;
"With the bridges out, that tunnel may be the only way to reach the docks and a boat to safety!""";;Fredrick Talimere;;;
14;My brother, Isthric the Tongue, went to check on the tobersk plants on one of the lesser islands.  He has not returned!  I am afraid that he is one of those stranded by the cataclysm. He may even be hurt!  If you were to fix the Portals of Stone, he would surely be able to return, and we could get help to those who need it!  Find him for me!;;Rohtnax;;
15;My Granda used to tell us of the times past, when the Portals of Stone were the main travel route between the islands.  She told us that the keys to the Portals disappeared during one of the first raids committed by the Regnan Pirates.  If the Portals of Stone were working my brother Isthric could return back to the main island!;;Rohtnax;;
16;That rude man?  He's more concerned with that Abandoned Temple than he is with the life that goes on around him!  My Granda warned him that the Temple is a place of great Evil.  He never listened.  Now Granda isn't with us anymore and we have no one but Brekish Onefang to remind us of the past.;;Rohtnax;;
17;We have offended the Ancients!  Why else would they call up the Mountain of Fire!  The Prophecies tell of a time when the oceans would boil!  This is the beginning of the end!;;Pascella Tisk;;
18;There are many Prophecies that tell of the destruction of Jadame and the entire world!   Most tell of a time when the world will be consumed by that which created it.  Perhaps the Ancients have decided to wipe us all out!;;Pascella Tisk;;
19;There is one Prophecy, the Prophecy of the Snake, that I have been unable to find a copy of.  I think it may be most revealing about the future of Jadame.;;;;
;;;;;
"Fredrick Talimere, the Cleric, has told me of the snake ruins, and of the Abandoned Temple.  He is in agreement with me, that there may be a copy of this prophecy, somewhere in the temple.  Could you find it for me?""";;Pascella Tisk;;;
20;You must find a way off of these islands. Someone must take news of what has happened here to our masters, the Merchants of Alvar!  They must know of the cataclysm and of the Regnan raid! ;;;;
;;;;;
"I've written a letter to the Merchants of Alvar representative in Ravenshore, Elgar Fellmoon. In it I explain our situation here. If anyone can advise us on what to do here, it is Fellmoon. Take this to him now.""";;Dadeross;;;
21;You must bring my letter to Elgar Fellmoon in Ravenshore!;;Dadeross;;
22;Take this crystal to Fredrick Talimere. I know that it has something to do with the portals of stone. Perhaps he can tell you how it functions.;;Brekish Onefang;;
23;Bring the portal crystal to Fredrick Talimere. He will know what it does.;;Brekish Onefang;;
24;The Merchant Council had sent our greatest warrior, Cauri Blackthorne, to consult with the Sun Temple priests about the disasters that have struck all of Jadame.;;;;
;;;;;
Cauri left for the Temple of the Sun in Murmurwoods shortly after rumors of the cataclysms were heard here in Alvar.  She was to return after consulting the priests.  We are very concerned that she has not returned.;;;;;
;;;;;
"As for your promotion, only Cauri can accurately test your skills and assess your worthiness for promotion.  If you find her, provide her with any assistance she may need and return here with news of her status and location.""";;Old Dark Elf;;;
25;Have you found Cauri?  We really need to know what happened to her!  Without her, we are all diminished!;;Old Dark Elf;;
26;Thank you for your assistance with the Basilisk Curse.  Usually I am prepared to handle the vile lizards, but this time there were just too many of them.;;;;
;;;;;
The Temple of the Sun asked me to check on a few pilgrims that were looking for the Druid Circle of Stone in this area.  When I found the first statue, I realized what had happened to the pilgrims.  ;;;;;
;;;;;
"I myself did not know of the increase in the number of Basilisks in this area.  They seem to be agitated by something.  I was going to investigate the Druid Circle of Stone when the Basilisks attacked me.""";;Cauri Blackthorne;;;
27;::Cauri looks over the Dark Elf(s) in your party::;;;;
;;;;;
To rescue me, you must have researched my path, and investigated the places I had been.  This demonstrates the intelligence needed to succeed in dealing with the world and business.;;;;;
;;;;;
To get to where I was attacked, you must have the skills needed to fight the Basilisks and other threats, demonstrating your prowess as a warrior.  Skill in battle is needed when proper negotiations break down.;;;;;
;;;;;
To ask me for promotion demonstrates desire, and without desire success will always escape your grasp.;;;;;
;;;;;
"You have all of the traits necessary to hold the title of Patriarch.  I will notify to Council upon my return.  It would be my pleasure to travel with you again.  You can find me in the Inn in Ravenshore.""";;Cauri Blackthorne;;;
28;I need to investigate the Circle of Stone further for the Temple of the Sun.  Hopefully not all of the pilgrims met the fate of these. Hopefully there are survivors!;;;;
;;;;;
"Something has agitated the creatures in this area, and I think the source can be found in the Circle.""";;Cauri Blackthorne;;;
29;You know…I have a power stone that will activate the portal to the abandoned temple. And you have one that will allow us to reach the island where that portal is!;;;;
;;;;;
If we joined forces, we could reach the temple with ease. What say you?;;;;;
;;;;;
"Fredrick Talimere offers to join your party.""";PLACEHOLDER;Fredrick Talimere;;;
30;Cauri returned and informed us of this assistance you provided her.  She also notified us of your promotion.  Congratulations, may your profits bring you much joy!;;Old Dark Elf;;
31;Cauri Blackthorne was here well over a week ago, maybe longer.  She had asked us many questions about the elemental incursions.  We provided her with what information we had here.  She said she would return to Alvar with the information.  Before she left, we asked her if she could do a favor for us.  We asked her if she could check on a group of pilgrims that were traveling to the old Druid Circle of Stone to the northeast of here.  She assured us that she would check in on them on her way back to Alvar.;;Cleric of the Sun;;
32;You come to me claiming to have a message from one of my caravan masters. Well, where is it then? If it was so important, perhaps you should have been better about not losing it along the way!;;Elgar Fellmoon;;
33;What is this? A letter from caravan master, Dadeross? Let's see…hmmm…;;;;
;;;;;
Well, it seems that serious events are afoot. It is a pity--what has happened on Dagger Wound. Serious action may need to be taken, but I require more information…;;;;;
;;;;;
"…and I think I know how to get it! Perhaps you would be interested in helping me? I will compensate you, of course. And, here. Take this as payment for delivering Dadeross' letter.""";;Elgar Fellmoon;;;
34;The local smugglers have the fastest boats in Ravenshore. If these were available to my agents, they could make quick scouting missions up and down the coast so we could see the extent of the cataclysm mentioned in Dadeross' letter.;;;;
;;;;;
"Here. Bring this letter to the smuggler leader, Arion Hunter. I'm sure it will """"persuade"""" him to lend his services. You'll find his hideout westward up the coast.";;;;;
;;;;;
"Oh, I almost forgot. The smugglers--they're wererats--and you know how they can be. Hunter can be reasoned with, but don't be surprised if his crew is less than civil.""";;Elgar Fellmoon;;;
35;Listen. We need those boats! Deliver my letter to Arion Hunter. Did you forget? His lair is to the west, up the coast!;;Elgar Fellmoon;;
36;Very good, and here is the payment we agreed upon. Hunter's boats will be useful to us through the crisis.;;;;
;;;;;
"Yes, """"crisis,"""" I say! Since your initial visit, several other caravans have missed their scheduled stops. There are also the rumors. Twice I've heard of the appearance of a burning lake of fire rising out of the desert.";;;;;
;;;;;
"Volcanoes! Lakes of fire! I fear the mysterious crystal has something to do with it. In any event, the guildmasters in Alvar must be informed!""";;Elgar Fellmoon;;;
37;As you may be aware, our guild headquarters is located in the city of Alvar. If you've never been there, the easiest way to reach it is to follow the river up through the canyon to the north.;;;;
;;;;;
"Go to the guild house and find Bastian Loudrin. Tell him about the crystal, and the rumors. Lourdrin will know what to do.""";;Elgar Fellmoon;;;
38;You must reach Bastian Loudrin in Alvar. Go! He must be informed of recent events!;;Elgar Fellmoon;;
39;This is the home of Cauri Blackthorne, greatest Dark Elf warrior.  She is currently out, working for the Merchant Council of Alvar.  Perhaps you should consult them as to her whereabouts.;;Old Dark Elf;;
40;You did all that to my guards just to deliver a letter! Let me see that…;;;;
;;;;;
…hmmm…Fellmoon wants my boats? Never! I…what!…he threatens my Irabelle…I…I…sigh…;;;;;
;;;;;
"V-very well. You can tell Fellmoon he can have my boats. I guess there's no refusing the Merchants of Alvar what they want.""";;Arion Hunter;;;
41;My cargoes are not the kind that want inspecting by harbor officials so my boats have to be, and are, the fastest on the coast of Jadame. They can even outrun a Regnan galley! From here they run west to Ravage Roaming and east to Shadowspire.;;Arion Hunter;;
42;Ancient Troll legends tell of a time when we did not live here in this desolate region.  They tell of a place that was quiet and tranquil.  We were driven from this place by the Curse of the Stone.  So for many hundred years we have dwelt here upon the Sand of Iron.  Now it seems we will be forced from this place as well.  The growing sea of fire has destroyed most of my village.  Many friends and family have perished.  This may indeed be the end of my Clan.;;;;
;;;;;
"There is a saying amongst my people, """"a thing lives only as long as it is remembered.""""  As long as I remember our homeland, then it will always be there for us to return too.  It just needs to be found.""";;TROLL PROMO;;;
43;Perhaps if you could locate our previous homeland, and check to see if the Curse of the Stone still exists.  If it does perhaps there is a way to remove it.  Any Troll in your party who completes this task would be promoted to War Troll of our Clan. Many honors are bestowed with this title, and you would be forever known to us as a legendary hero.;;;;
;;;;;
"One of our warriors, Dartin Dunewalker, set out to find this place.  He left thinking he would find clues among the stone fields of Ravage Roaming.  Perhaps you can find him there and work together--or at the least, find clues that will lead you to our goal.""";;TROLL PROMO;;;
44;The Alliance must be completed, and a unified course of action decided upon.  Return to Alvar and consult the Merchant Council.;;TROLL PROMO;;
45;You have found our Ancient Home?  Its located in the western area of the Murmurwoods?  This is wonderful news.  Perhaps there is still time to move my people.  Unfortunately the Elemental threat must be dealt with first, or no people will be safe! ;;;;
;;;;;
"All Trolls among you have been promoted to War Troll, and their names will be forever remembered in our songs.  I will teach the rest of you what skills I can, perhaps it will be enough to help you save all of Jadame.""";;TROLL PROMO;;;
46;"You were sent to find the Ancient Troll Home?  Your assistance is welcomed!  I am at a loss; the clues I followed to this region have lead to a dead end.  No one here knows about the Curse of the Stone mentioned in our legends.  The Ogre Mage, Zog was less than helpful.  I was lucky to escape his fortress with my life. ";;;;
;;;;;
"Although, he may have provided assistance with out meaning too!  When I mentioned the Curse of the Stone, he said if I bothered him further, he would be sure to cage me with his pet Basilisk!  Basilisks roam the Murmurwoods!""";;Volog Sandwind;;;
47;Thanks again for your assistance with the Basilisk curse!  Hurry back to Alvar!  We must do what we can to save Jadame.;;Cauri Blackthorne;;
48;Thanks for finding our Ancient Home, once the treat to Jadame has been handled we can begin to move there!;;TROLL PROMO;;
49;Have you found the Ancient Home for our Clan?  Without its location, my people will surely perish!;;TROLL PROMO;;
50;Disaster in Dagger Wound, too? This is indeed disturbing. If one were to believe all the rumors, one would think that all of Jadame is in upheaval and chaos.;;;;
;;;;;
I wish I knew more. I rely on our caravan masters for news, but all who were supposed to arrive here this month have not. What I do hear, troubles me. Hurricanes, floods, and now a volcano! The worst I've heard is that a sea of fire has appeared in the Ironsand Desert--and this from many sources.;;;;;
;;;;;
"I wonder if this crystal in Ravenshore has something to do with it. Its appearance at the onset of the calamity seems to be more than a coincidence.""";;Bastian Loudrin;;;
51;All of this upheaval is seriously impacting our guild's business. I need more information, but I'm being buried in gossip and rumor.;;;;
;;;;;
Many tell me of this sea of fire in the Ironsand Desert. I've heard the tale enough that I almost believe it. Confirmation or denial of the lake's existence would be of great help to me.;;;;;
;;;;;
"If you would serve me, go to the Ironsand Desert and seek this lake. If it is indeed there, find me someone who saw it appear. Bring him back here so I can hear his story myself.""";;Bastian Loudrin;;;
52;I must know more about what is going on in the Ironsand Desert. I can't use more rumors. I have enough of those already.;;;;
;;;;;
"I need you to actually go there. The desert is several days travel to the east.""";;Bastian Loudrin;;;
53;Well, so it is true. Imagine…a lake of fire. But where is my eyewitness? I need to speak with someone who saw its formation. This is important…for reasons I'm unwilling to discuss with you now.;;;;
;;;;;
"Find me someone who saw the birth of the lake of fire! Try searching the Troll village, Rust.""";;Bastian Loudrin;;;
54;You must form an alliance to stand against our threatened oblivion! Seek support from the Necromancers' Guild, Temple of the Sun, Minotaurs of Ravage Roaming, Dragons of Garrote Gorge, and the Dragon hunting party of Charles Quixote in Garrote Gorge. I'm sure that you will find it impossible to get all of them to agree to work together, but still, you must make your best effort.;;;;
;;;;;
"If we are to survive in this time of prophecy, my sages tell me that at least three of the groups I mentioned must agree to work together. Go and do this thing. If you value this world and your lives, go!""";;Bastian Loudrin;;;
55;You have done what I feared was impossible. Though these times are fraught with uncertainties, that you have united key factions of Jadame goes a long way towards securing our continued existence.;;;;
;;;;;
Well, I have done what I can. I leave the defense of the land to the alliance council. I hope they find the accommodations I have provided them in Ravenshore to be adequate--the guild house there is not our most luxurious. Still, I though it would be best if the council was located near the crystal.;;;;;
;;;;;
"I wish them, and you, good luck!""";;Bastian Loudrin;;;
56;Yes, I was here when the lake of fire first appeared. A strange gateway appeared on the desert plain outside the village. The fire you see spilled forth from it. The fire spread like water poured on the ground.;;;;
;;;;;
A wave of flames rushed over the edge of the village. Most of my people were lost instantly. What remains of this village is as you see it.;;;;;
;;;;;
"I was in the hills overlooking the village when this all happened. I saw it all, but I can hardly believe it.""";;Overdune Snapfinger;;;
57;I would come with you, If it were not for my father. So deep is his mourning for my brother, Vilebite, that he cannot care for himself.;;;;
;;;;;
My father believes that Vilebite's soul cannot rest until his remains are at rest in the village tomb. Unfortunately, Gogs infested the tomb when the lake of fire appeared.;;;;;
;;;;;
"Here! Take my brother's ashes. I'm sure my father's grief will lessen if they are placed in the tomb. Do this for me and I will travel with you to Alvar.""";;Overdune Snapfinger (add tomb details after tomb done and placed);;;
58;I will go with you only after my brother's ashes are safely in the village tomb.;;Overdune Snapfinger;;
59;You have done my family a great service. With his ashes safe in the holy sanctuary of the village tomb, Vilebite can lie in peace. My father, too is greatly improved. We have talked and I believe that he can now take care of himself while I accompany you to Alvar.;;Overdune Snapfinger;;
60;Vilebite was a good son. I will miss him. But at least I can take comfort knowing that he is at peace. Thank you for your kind and heroic deed.;;OVERDUNE'S FATHER;;
61;My father believed that the Necromancers of Shadowspire were attempting to create an undead Dragon.  This would be a truly horrid beast. He believed is was his personal duty to stop them.;;Leane Stormlance;;
62;My father Blazen, left here years ago to slay the Skeletal Dragons in the Shadowspire Region. Unfortunately, he has never returned.  He took with him, Ebonest, the greatest Dragon slaying spear ever forged. Charles Quixote has never forgiven my father for taking Ebonest with him.  Unfortunately we have no idea what befell my father.  Because my father was Charles’ second in command and responsible for the loss of Ebonest, Charles is unwilling to promote me to Champion, regardless of the merit of my skills. Perhaps if you find Ebonest, Charles with promote your knights and myself to Champions!;;Leane Stormlance;;
63;I was captured in the center of the Mad Necromancer’s lab.  There I was tortured and many curses were placed upon me.   Ebonest must have been taken from me when I fell, and perhaps is still in the central chamber.  If you were to recover it and return it to Quixote, at least my family name will be cleared, and my daughter can continue her life without my failure haunting her.;;Blazen Stormlance;;
64;Perhaps the Clerics of the Sun have a way to cure me, for they would be the only ones who would know how to counter the dark magics that afflict me. There is a friend of mine in Ravenshore named Dervish Chevron. He left the Temple of the Sun years ago to pursue his own research into the mysteries of Jadame.  Perhaps he would know of a cure, or even have it in his possession.  If he cannot help, promise you will return here and kill me so I may at last be at rest!;;Blazen Stormlance;;
65;Zanthora moved here from the Shadowspire to continue experiments she began at the Necromancers' Guild.  She desired to create the ultimate horror, the Skeletal Dragon.  Her fellow Necromancers feared the end result. If the created Dragons where ever to escape Zanthora’s control, there would be no stopping them.;;Blazen Stormlance;;
66;Blazen Stormlance was my lieutenant and my friend.  I never understood his personal quest--this need to find these rumored Skeletal Dragons.  He took my greatest tool with him.  With Ebonest in my hand, I would have the Dragon problem well in hand.  ;;Charles Quixote;;
67;The Clerics of the Sun imbued this spear with their blessings, making it the strongest spear forged.  Its power is said to be able to slay any Dragon with one blow.  If this were so, I could end my conflict quickly, cleanly and efficiently.;;Charles Quixote;;
68;"The Gem of Restoration may cure the knight, Blazen Stormlance, of what you say has befallen him.  There is no love lost between the Temple of the Sun and the Guild of Necromancers; any opponent of theirs is definitely a friend of ours.  Restore Stormlance to life so that he may rejoin Charles Quixote.";;;;
"		Dervish Chevron";;;;;
69;Have you found my father?  Or the spear Ebonest?  We must get it back to Charles Quixote!;;Leane Stormlance;;
70;You found Blazen Stormlance?  What about MY spear Ebonest?  You have that as well?;;;;
;;;;;
FANTASTIC!;;;;;
;;;;;
"I thank you for this and find myself in your debt!  I will promote all knights in your party to Champion and teach what skills I can to the rest of your party. """;;Charles Quixote;;;
71;What is this?  You ally with my mortal enemies and then seek to do me a favor?;;;;
;;;;;
I wonder what the Dragons think of this. But so be it.  I am in your debt for returning Ebonest to me.  I will promote any Knights in your party to Champion, however they will never be accepted in my service.  The rest I will teach what I can. ;;;;;
;;;;;
"I do not wish to see you again!""";;Charles Quixote;;;
72;"""An alliance to unite Jadame,"" you say. If it wasn't Lordrin who was proposing it, I would normally have slain you for my supper.";;;;
;;;;;
While intriguing, I cannot consider the idea now. We are under daily attack by the accursed knights of Charles Quixote. If he were not a problem, I could do as Lordrin asks.;;;;;
;;;;;
"Perhaps you could help me with Quixote?""";;Deftclaw Redreaver;;;
73;Last month one of Quixote's raiding parties invaded our caves. They slew many and took with them the egg containing my unborn heir. While those foul slayers hold the egg, we cannot attack their encampment.;;;;
;;;;;
"If you were to return the egg to me, I could destroy Quixote. Do this for me and I will join your alliance.""";;Deftclaw Redreaver;;;
